2001	Unremarkable wines, with rain leading to dilution in many examples.	0.0198361873626709	A vintage that rewarded the quality-conscious. A usefully wet start to the growing season was followed by prolonged very hot, dry weather, broken by rain just before harvest in March. Some grapes suffered sunburn but lower-yielding vineyards produced true quality.	0.996893882751465	NA	NA	A hot, dry summer with making concentrated reds, especially Cabernet Sauvignon and Carmenère.	0.999114811420441	Flowering was extended by low temperatures. Late autumn warmth made up somewhat for a coolish summer and wet September, which robbed the region of a great vintage but there are some excellent wines drinking well now.	0.999665021896362	The rain that spoilt the reds encouraged botrytis to such an extent that this is a truly magnificent, long-term vintage, helped by a greater degree of selection and cellar expertise than ever before. Perhaps the greatest Sauternes vintage in modern times.	0.999606013298035	Wet summer with some heat spikes. As for red bordeaux from this vintage, a gentle hand was needed in the winery to retain delicacy and not emphasize the already notable tannins. Quite varied quality. Wines from low-yielding grapes will provide exciting long-term drinking but others are gawky. August hail in Volnay.	0.0401508808135986	A generally poor vintage characterised by rot and underripeness thanks to a wet and gloomy September.	0.00023341178894043	Good for Muscadet, but bad for Sancerre and Pouilly-Fumé where late rain caused rot. Anjou enjoyed fine, late summer warmth allowing the production of particularly good sweet wines.	0.999839425086975	Lauded vintage, the result of a very hot, dry summer. An unusually prolonged _mistral_ at the end of August resulted in thick-skinned berries and accentuated tannins. Later harvesting resulted in better balanced wines - especially in higher-yielding vineyards - but acid levels are dangerously low in some cases. There should be some very long-lived top wines however.	0.974432110786438	Extremely varied, large crop which depended on crop-thinning and extremely careful selection to produce exceptional wines. Hot August was followed by dangerously wet September, which sometimes resulted in dilute Merlots and tart Cabernets. Some good value to be found here, and with time the 2001s showed better and better - especially on the right bank where it can be superior to 2000.	0.991558969020844	The low temperatures of September helped maintain freshness and produced well-etched, fruity flavours with good acidity.	0.999852895736694	Erratic weather produced some rot but also some surprisingly good white wines, if not for the long term, as well as some rather thin, disappointing ones. A variable vintage that rewarded those who limited yields. Devastating hail in parts of the Côte Chalonnaise.	0.998771548271179	Summer was so hot and dry that some vines shut down and stopped ripening. Rain in September was a relief for those who picked after it although the wines picked too early may be uncomfortably tough. White wines are particularly concentrated.	0.987806618213654	One of the most successful regions in France in 2001. Almost as good as 1999 if more elegant and less concentrated than 2000.Very respectable levels of ripeness and good acidity and ripe tannins to support them.	0.999791622161865	A very great, long-term vintage with remarkable levels of both grape ripeness (thanks to a wonderful Indian summer) and acidity (thanks to a nerve-wrackingly wet but cool September). A high proportion of botrytised sweet wines were made - in fact there was such a shortage of basic QbA wine that considerable amounts were declassified to satisfy market demand.	0.986758828163147	Excellent quality (and quantity) from an early vintage slightly more in the voluptuous mould of 1999 and 1997 than particularly long-term. No shortage of ripeness or structure, but an occasional shortage of acidity.	0.998063862323761	Smallish crop thanks to April frosts. June and July were dry but August and especially September were quite wet with rain threatening vine health as harvest time approached.	0.0148276090621948	Exceptional quality on the south island, but was lighter in style on the north island.	0.99950236082077	Some very good vintage port. Exceptionally wet winter - an unprecedented five months of rain - was followed by early budburst slowed by a cool spring. The crop was reduced by a heatwave in June but conditions were favourable throughout the rest of the summer. Useful quantity with good not great quality.	0.975434720516205	Continued the run of hot vintages, and produced a very small harvest of concentrated reds. Tannins were generally softer than in 2000.	0.991675496101379	NA	NA	Smaller-than-usual crop because of spring frosts but distinctly superior quality accentuated in some cases by further deliberate crop thinning. Some very fine wines.	0.996202647686005	NA	NA	A respite for growers plagued by unusual conditions in both 2000 and 2002 with most varieties ripening evenly when expected, although some Cabernet vines shut down in August. A coolish September was a boon.	0.995655655860901
2000	A cool vintage, leaving the wines with high acid and fresh fruit.	0.999858260154724	Very challenging vintage conditions which included poor flowering, hail, exceptional heat in summer and rain during harvest. There were problems with colour stability. Small crop.	0.0170376300811768	NA	NA	NA	NA	An exceptional vintage in every sense with a very early flowering and a very favourable growing season. A little rot of all sorts developed at the end of August and rains in October were sometimes heavy but good quantities of excellent wines, including late harvest styles, were produced.	0.999803423881531	Some pretty, bumptious wines for relatively short-term drinking but there was too much rain after the red wine harvest for the development of botrytis.	0.00128895044326782	A difficult vintage for growers, with rain and rot during harvest. Rather soft, easy wines that were more successful in the Côte de Nuits than in much of the Côte de Beaune. Useful early drinking but showing signs of losing fruit by 2008.	0.00595235824584961	Hail, rainstorms, unseasonable cold and mildew made for a testing growing season, but fine conditions in August and September redeemed the vintage. High quality wines for short-term drinking.	0.999686479568481	Despite a wet July, quality turned out very well for dry whites and reds. Yields were marginally below average, and there was insufficient ripeness to create any moelleux styles.	0.304518520832062	Conditions were excellent until quite heavy rains arrived on 19 September. The results, especially from those who picked early and fast, are plump, approachable wines capable of giving great pleasure even if they will not be the longest-lasting.	0.999734580516815	Nature's benevolence coincided with the commercial imperative to have a good vintage in this numerically exceptional year. Great consistency and balance. The petits châteaux represented some of Bordeaux’s best value for many years though most are ready to drink or even starting to decline. The best wines should last well into their second or even third decades.	0.999668717384338	Summer was if anything too hot to produce nervy wines and most of these were best drunk young, although there are one or two great wines at the top of the tree.	0.0504457950592041	Extremely ripe, sometimes too ripe, healthy grapes with fairly good acidity that were able to charm even in their youth. Especially good for Chablis and the Mâconnais.	0.999790728092194	Devastating floods in November 1999 damaged some vineyards, as did storms in June and July but the summer was warm and dry (though not excessively so) and was followed by a prolonged harvest with some very good quality wine. Lovely, round, supple wines with ripe tannins.	0.999700307846069	Good to very good if overshadowed by its predecessor. August was hot with heavy rain on 21 August. September enjoyed exceptionally fine weather allowing a particularly prolonged harvest. Both red and white wines are very charming.	0.999838650226593	Very difficult vintage. Early optimism was finally dashed by September rains which severely compromised the health of the grapes. In many cases the earliest-picked grapes were the best because they were the least affected by rot. Early-picked Spätburgunders were relatively unscathed.	0.00729811191558838	Very good, partly thanks to a prolonged heatwave from mid-August to mid-September. Dolcettos were relatively simple but both Barbera and, especially, Nebbiolo were exceptional with excellent acidity as well as ripeness and great definition of flavour. For the long term.	0.999815225601196	Easy, ripe wines from a very hot, dry vintage which, unless vineyards were extremely well-managed, resulted in wines with a certain hollowness, though no shortage of alcohol.	0.0773166418075562	Much lower yields thanks to rot caused by rain. Marlborough was one of the best regions of the country.	0.997144877910614	Mild and exceptionally dry winter was followed by a wet spring which delayed the growth cycle. An unusually hot September gave the grapes a late boost just before harvest in benign conditions. The result of this, together with the introduction of new, mechanised alternatives to foot-treading in some houses, is a range of particularly luscious, ripe vintage ports.	0.99601012468338	The third hot year in a row. Whites were unimpressive, but reds were powerful and concentrated, with high tannic structure.	0.99839723110199	NA	NA	Record crop levels and extremely variable quality with exceptionally high summer temperatures and in many cases a lack of concentration. Some very good wines from Ribera del Duero though.	0.581659555435181	NA	NA	Long, late, 'European' vintage thanks to an unusually cool, wet summer. There were very real concerns that Cabernet Sauvignon would never ripen in some vineyards. A particularly good year for Pinot Noir and Chardonnay.	0.998986423015594
1999	NA	NA	The record crop was more the result of increased plantings than any natural phenomenon. Several years of drought conditions continued until summer, which was plagued by some storms which compromised vintage health. A cooler year than 1998.	0.00306212902069092	NA	NA	NA	NA	Rain plagued the growing season and brought rot and mildew. Fine weather began in mid August and continued for a month so that careful vignerons looked forward to good quality but hopes were dashed by yet more rain.	0.00496155023574829	Those producers who used only the very rich, botrytised grapes picked first produced some exciting wines but quality is extremely variable as later-picked grapes suffered somewhat.	0.0329341888427734	Exceptional quality and quantity. Powerful, charming and well balanced with great concentration and colour - particularly in the Côte de Beaune. The Côte de Nuits was hampered by a little more rain. Tannins and pigments achieved sumptuous ripeness. A vintage to drink young or old.	0.999832630157471	NA	NA	NA	NA	Rather more challenging vintage than 2000 for growers and wines with less obvious richness than 1998 for wine drinkers. Heavy rains plagued the harvest and quality is distinctly variable.	0.827153086662292	Good potential created almost exclusively by three weeks of sunshine from late August was diluted by rain at harvest time. Hail also devastated some St-Émilion vineyards in early September. A cool, humid start to the growing season led to excessive vegetation initially. Fairly early maturing wines with better potential on the left bank.	0.0568900108337402	Some attractive, aromatic Sauvignon Blanc was harvested but the Sémillon fruit was often dilute.	0.00264686346054077	Large crop ripened by fine weather in late August and early September. Generally slightly crisper than the 2000s and the best may last longer - if they are allowed to.	0.996751189231873	An exceptionally dry winter was followed by heavy rainfall, and some hail in Roussillon, at the end of April. Wines are respectable but not as exciting as the vintages immediately before and after.	0.0257285833358765	Exceptional quality. A sunny harvest saw good quantities of healthy grapes - a cause for real celebration in the northern Rhône. Quality is at least as good as 1998 (some compare it with 1947) and the quantity was much higher.	0.999744534492493	Everything was going so well...until the rains which began on 20 September and continued throughout the harvest. Careful selection was needed and in some cases yields were too high for real quality. Acids were generally low but some delicious wines for relatively early drinking were made by the best producers.	0.993851542472839	Very good quality yet again for Nebbiolo-based wines, and Dolcetto which was much more successful than the later-ripening Barbera. Voluptuous Barolo and Barbaresco recalls 1997.	0.999682247638702	Quite exceptionally good quality. A vintage not unlike 1997 but with arguably more finesse and less sheer mass. Warm summer led to an early harvest of healthy grapes.	0.999608159065247	NA	NA	At the end of August growers were looking forward to a distinct improvement on 1998 but hopes were washed away by continuous rain in September, although the thick-skinned port grapes suffered much less than table wine grapes elsewhere in Portugal.	0.00257521867752075	NA	NA	NA	NA	April frost in Rioja delayed ripening of grapes that suffered thanks to summer rains. Better quality in Ribera del Duero, however, although harvest rain reduced acidity. Good quality but not quite as good as	0.0384910702705383	NA	NA	Very late, dry, cool growing season which depended crucially on ripeness being boosted by a late September heatwave. A late rush resulted in many varieties ripening simultaneously leading to a short, extremely pressurised harvest. Some luscious Cabernets were made as a result of the relatively new preoccupation with extended 'hang time'.	0.0513426661491394
1998	NA	NA	Was then a record crop from an early, frantic vintages despite drought conditions. Some fine reds.	0.99895054101944	NA	NA	NA	NA	Early harvest of very ripe grapes with some botrytis.	0.347157120704651	Rather loose, early-drinking wines without strong botrytis influence.	0.000779151916503906	Thick skins made for good colours but pretty tough and stolid wines in general.	0.997815907001495	NA	NA	NA	NA	Much garlanded vintage that struggled to live up to its reputation during its teenage years.	0.0183992981910706	Very good on the right bank but a less starry performance in the Médoc, whose 1998s are a bit stolid, means that these wines, and their equally successful counterparts in Graves have tended to be overlooked.	0.190328776836395	Attractive wines with no shortage of ripeness.	0.999820530414581	Everything went wrong: frost, hail, powdery mildew. Respectable, considering.	0.834942638874054	Very good, small crop.	0.999858796596527	Very dry summer stressed the vines. Some tough wines for the long term.	0.021712601184845	Despite a wet growing season the wines showed vibrant acidity and bright fruit. Eiswein was made in some quantity.	0.999788045883179	More structure and potential than 1997 and some very fine, elegant wines.	0.999844193458557	Irregular vintage after another hot summer which stressed the vines.	0.030419647693634	NA	NA	Definitely not a year for vintage port.	0.000509679317474365	NA	NA	NA	NA	Despite spring frosts, yields were still too high to ripen some grapes sufficiently in Ribera del Duero. Quantity was also Rioja’s strong suit.	0.497912526130676	NA	NA	The cliffhanger vintage that was as late as 1997 was early. Wines tend to lack stuffing, although some Cabernets took on surprising charm after 10 years in bottle.	0.0548298954963684
1997	NA	NA	Vintage saved by a hot April with some fine Shiraz made, eventually, which should have a long life.	0.362170338630676	NA	NA	NA	NA	Some really excellent wines. Early harvest of very ripe grapes plus some outstanding sweet, later picked wines.	0.999852061271667	Some very attractive, if not especially heavy, wines from the top producers. Ready to start drinking.	0.999608218669891	Charming, early-drinking wines – most should have been drunk by now.	0.995785236358643	NA	NA	NA	NA	Rather muddy flavours from well ripened grapes.	0.0228875279426575	Far from dramatic and early developers, these wines were ludicrously overpriced initially but provided some easy drinking in the early years of this century. Few show any possibility of improvement.	0.0277302861213684	Rather lacklustre without much depth or personality.	0.00019073486328125	Charming wines for relatively early drinking.	0.999861538410187	Large crop, difficult season.	0.0137819647789001	Early maturing, soft wines from an early harvest.	0.999139070510864	Early, large crop of very attractive wines – generally clustered around Spätlese level of ripeness, although there are some lovely Mosel Auslesen.	0.998125731945038	A hot growing season resulted in record ripeness levels but some worryingly low acidities.	0.00447523593902588	Hot summer and very ripe grapes that produced wines that seemed unusually luscious at the time even if some could do with a little more freshness.	0.999180257320404	NA	NA	Some fine vintage ports. Early flowering was followed by a fairly cool, wet summer so the ports are more structured than the 1994s.	0.99897962808609	NA	NA	NA	NA	Rain at harvest. Not glorious.	0.000311493873596191	NA	NA	Early, generous harvest of widely admired wines with all varieties ripening at once. To drink now.	0.999852299690247
1996	NA	NA	A big vintage at last, with sugars boosted by a late burst of heat.	0.999701082706451	NA	NA	NA	NA	Solid but not desperately exciting wines.	0.999450087547302	Very slightly less successful than the 1997 vintage.	0.000241219997406006	Remarkably high acidity has made its presence increasingly felt over the years in bottle. Some wines just too tart for comfort; others may eventually bloom.	0.130057036876678	NA	NA	NA	NA	Coolish, damp summer produced lighter-than-usual wines.	0.999266088008881	Some very fine, potentially long lived wines, especially in the Médoc, although robust tannin levels recall 1986s in many cases.	0.997722387313843	Like most French 1996 whites, vivacious, crisp wines.	0.999781966209412	As with the reds, acidity is the keynote. The best-balanced are stunning but some are a bit meagre.	0.336635649204254	Large crop and a rainy summer which affected reds more than whites.	0.983469367027283	Solid, unexciting but ready and competently made.	0.999866247177124	Attractive, lightish Mosels and southern wines with more stuffing. A very good year for Eiswein.	0.999777257442474	Superb Barolo and Barbaresco for keeping.	0.99950110912323	Very varied year producing soft, early maturing wines that should have been drunk by now.	0.171472489833832	NA	NA	Not a year for vintage port but some fine single quinta wines were made.	0.999523520469666	NA	NA	NA	NA	Particularly successful in Ribera del Duero, where ripe, relatively friendly wines were made.	0.999777138233185	NA	NA	Small crop of relatively lightweight wines, most of which should probably have been drunk.	0.00688713788986206
1995	NA	NA	Inconveniently small crop but some good Shiraz and Rieslings, especially in Clare, where quantities were better than elsewhere	0.969545245170593	NA	NA	NA	NA	Varied year in which those who picked low-yielding vineyards well after the rains made great Rieslings, some very ripe. Rot threatened everyday wines. Slightly reduced crop.	0.000627100467681885	Best Sauternes vintage since 1990 - so probably initially overrated. The noble rot developed so rapidly that most of the grapes were picked by early October. Not the most complex vintage.	0.0041620135307312	Reduced crop of initially rather austere wines which took on fat in bottle and can provide delicious drinking now.	0.996906161308289	NA	NA	NA	NA	Very good colour and really ripe, concentrated reds. Some producers claim it is better than 1990.	0.99976122379303	Hot, dry summer resulted in early harvest of healthy Merlot grapes. Relatively tannic Cabernet Sauvignon was picked after a week of mid-September rain. Generous crop levels, best in Pomerol and Pauillac.	0.999489784240723	Lots of body and flavour and structure thanks to the warm summer wherever grapes were picked before the mid-September rains.	0.999592959880829	Very small crop producing wines with real concentration.	0.999342143535614	Excellent ripeness and concentration in reds, especially in the hills.	0.999828636646271	Very promising vintage which is just starting to come round at the top end.	0.99947714805603	An unusually warm summer was followed by a cold, wet late August and September so that the bulk of wine produced was rather ordinary, but the late, great Riesling showed its stuff in the Mosel after a very warm October.	0.342470765113831	Hail-reduced crop of deep-coloured wines made from grapes which benefited from a sunny autumn. Probably a notch below 1989 and 1990.	0.104240953922272	Nail-bitingly late harvest saved by an unusually warm, dry October, although acids are still generally high.	0.0242491364479065	NA	NA	Some real potential for vintage port.	0.999371647834778	NA	NA	NA	NA	Another frost-shrunk crop in Ribera del Duero, although the grapes were riper and probably better balanced than in 1994. Rioja's bodegas, on the other hand, were swollen by an enormous harvest of ripe, healthy grapes.	0.755404651165009	NA	NA	Yet another region in which a warm, dry autumn and late harvest saved the day after a difficult growing season. Reds, especially Zinfandels, may be even better than 1991. Small quantities pushed up prices, however.	0.980766355991364
1994	NA	NA	Exceptionally dry but not too hot: the resulting wines are deep and structured, especially from the Barossa Valley.	0.999675333499908	NA	NA	NA	NA	September rain, but impressive wines from those brave enough to pick late.	0.999678611755371	Grey rot in September, so choose the châteaux that could afford to be fussy.	0.00042194128036499	A year to highlight Burgundy's infamy for variability as too many let yields balloon after the rains.	0.0229631066322327	NA	NA	NA	NA	Early harvesters were luckier, most picked in rain, so only average quality.	0.0116753578186035	The best year since 1990 (which is not saying that much). Nicely ripe but September rains were a problem again for less conscientious producers.	0.996747732162476	Potentially superb as fully ripe grapes were again gathered before the rains.	0.999269485473633	Generally better than the reds and certainly more consistent, especially the Mâconnais.	0.999766051769257	Probably France's most successful region: a small crop with real richness and concentration.	0.999866485595703	All-too familiar autumn rains before the fruit could ripen.	0.00069040060043335	Horribly variable, but Riesling showed its class with superb quality from the good estates.	0.999796628952026	Sugar and acid levels reasonable despite prolonged September rains. Not up to Tuscany’s performance.	0.942519903182983	At last a dry but cool harvest: rich and structured and certainly the best since 1990.	0.999861001968384	NA	NA	Potentially exceptional year for vintage port. Very rich but not overripe wines.	0.999745428562164	NA	NA	NA	NA	Quality isn't a problem but quantity is after spring frosts and summer drought. Some very nice wines indeed.	0.999376237392426	NA	NA	Generally compared to 1991, the slow ripening benefited the reds especially.	0.999467074871063
1993	NA	NA	Ripening was slowed by an unusually cool and wet spell. A challenging year with the whites especially more variable than usual.	0.98615425825119	NA	NA	NA	NA	A good year: ripe wines of weight and intensity.	0.999839544296265	Another pretty dreadful autumn, hardly anyone made interesting wine.	0.000217735767364502	Underrated. Better than average: healthy grapes and well-coloured, fruity wines that have lasted and developed well.	0.999868273735046	NA	NA	NA	NA	An unwelcome repeat of 1992's weather: diluted, easy-drinking wines.	0.00328606367111206	Another wet harvest. Picked earlier, the right bank a better bet than the left.	0.00214302539825439	Avoided the rains: generally good, soft and full, sometimes outstanding.	0.999846160411835	A large, ripe harvest struck by rain, so concentration was a problem.	0.0139036774635315	After a wonderful summer this was an exciting vintage.	0.999877989292145	A great summer then rain, hail and mildew, so light, soft wines are the rule.	0.998432338237762	A nerve-racking year. Rain hit the early harvests but patient growers picked grapes with welcome botrytis. Some fine wines still showing well.	0.999425828456879	Nebbiolo and Barbera didn't really ripen before it rained. May be similar to 1988.	0.00279808044433594	Survived the rains better than Piemonte, concentration held up, but some picked unripe fruit.	0.0786073207855225	NA	NA	NA	NA	NA	NA	NA	NA	Heavy harvest rains again. Good but not great seems the rule.	0.0172774195671082	NA	NA	Erratic growing conditions reduced eventual yields. A mixed bag.	0.000203549861907959
