2011	A generally cool, damp year in Argentina. Frost and hail caused some damage too, so careful selection was required to produce the best wines. On the plus side, the coolness made for particular aromatic intensity in white wines.	0.998901009559631	Wet across most of Australia, and 'one of the toughest in 25 years' according to Peter Gago of Penfolds, with lots of botrytis and mildew infections. Whites are generally thought better, with some excellent Clare Valley Riesling where fruit selection was stringent.	0.0692140460014343	Generous yields were welcome following several lean years. Hot weather caused resulted in relatively high alcohol levels, while acidity levels are low. Whites tend to be full bodied with good ageing potential and all red varieties fared well, with some declaring this vintage the best thus far for Austrian red.	0.9997678399086	Another cool year, with many whites recording very low alcohol levels. Elegance and balance are keywords, in a similar style to 2010.	0.998014569282532	Good quality in an early-maturing, drinkable style - but not so impressive as 2010 or the superior 2009s.	0.993838667869568	Where red Bordeaux failed, Sauternes triumphed in 2011, giving opulent, rich, fresh wines of excellent quality.	0.999841332435608	Disappointing quality with widespread rot and uneven weather conditions throughout the year. The results can be surprisingly good in parts, but 2010 is a much safer bet.	0.558902561664581	Notable for its erratic growing season, which started warm and dry but then became cooler and wetter in June and July. Conditions improved briefly in August but the (early) harvest was problematic.	0.00641626119613647	Pretty rotten. Muscadet and Touraine were both blighted with fungal disease. Cabernet Franc only flourished in the best sites and with suitable selection. Chenin Blanc had a much better year, with Anjou and Coteaux du Layon being particularly impressive.	0.940919578075409	Reasonably good quality and good yields, but won't be as brilliant as the preceding two vintages. Often drying tannins.	0.98590475320816	Generalisations are difficult in this variable year, but there is agreement that quality is back down to earth after the excitement of 2009 and 2010, with lower alcohol and generally higher tannins too. A forgettable year.	0.0134472846984863	Some real energy and excitement in dry whites.	0.998763501644135	Less ripe than the previous two vintages, needing chaptalisation in many cases. Chaotic weather made this a tricky vintage overall.	0.00723928213119507	A rainier year meant that volumes were finally back to normal after three lean years - however, it also created a problem with rot in the vineyards. A difficult year but one that has produced some very well balanced, successful reds.	0.999536037445068	Untimely rain in early September diluted what was otherwise a very promising crop. Quality still good, but certainly not at the level of 2010 or 2009.	0.353802084922791	Extremely good quality, with yields back at average after two more depressed years. There is palpable excitement about these wines, with top quality examples across the board from trocken Riesling and Spätburgunder and record-breaking noble whites.	0.999822616577148	A very hot year which has nevertheless resulted in some very good, supple, ripe but not stewed wines, even if at times the higher alcohol (15% and sometimes more) make some of them unbalanced. A very warm April set expectations for a harvest a full four weeks earlier than usual. A distinctly cool June and July slowed the growing cycle down considerably, but August was so hot that Dolcetto raisined on the vine. Rain at the beginning of September accelerated ripening again. Cool nights saved Nebbiolo from overripeness, yet harvest was still a full two weeks earlier than the norm.	0.810452401638031	An exceptionally hot vintage with a very irregular weather pattern. A very cold and snowy winter preceded an unusually warm beginning of spring, although budbreak was not much earlier than normal. April was very hot, followed by a cool May. This pattern of alternating cold and hot periods had a ‘stop-go’ effect on the growth of the vines. The middle of August brought record-breaking heat and the grapes seemed prematurely ready, with some producers picking at the end of August to rescue the fruit from the burning sun. September remained extremely warm and 2011 was the year in which the sorting table arrived en masse in Chianti Classico. Many wines are rich, but fortunately still have enough freshness, although it is doubtful that this will remain during prolonged bottle ageing.	0.99381297826767	Warm and ripe across New Zealand, with a bumper crop of grapes.	0.999859929084778	The rain of 2010 was crucial in this much drier year, to sustain the vines through a hot summer. There was, finally, much needed precipitation in late August and September with dry, warm conditions thereafter which were perfect for picking. Looks to be a great quality vintage.	0.999567091464996	Drought, resulting in reduced yields and particular concentration in reds. Not an auspicious vintage.	0.00030982494354248	Very hot throughout August and September, creating some dehydration. Immensely powerful wines with a great deal of flesh.	0.999836087226868	Hot and heat-stressed for the vines in Rioja with lower acidity than average but powerful, concentrated wines of good quality. Similarly hot in Ribera del Duero, giving very powerful intensity and smooth, soft tannins.	0.999774158000946	Poor flowering with widespread _millerandage_ especially on Pinots saw some growers struggling. Fair quality, but not the greatest. Total vintage 3.02 m bottles off 1,208 hectares.	0.00310128927230835	Miserable conditions made for a very challenging harvest, with mildew and botrytis rife in Napa and Sonoma. Volumes are therefore low for the second consecutive year, with the best quality only found where growers managed to pick ripe fruit before the rainstorms in October.	0.00163990259170532
2010	Reds have slightly lower than average alcohol, thanks to a cool ripening season. Fruit was harvested in good health, but quality was not as good as the exceptional 2009s.	0.0177469849586487	This was the year that the rain finally came, breaking a long drought. This brought some problems later in the season, with excess rainfall encouraging some mildew, but generally the impression is a positive one across the state.	0.998678624629974	A challenging vintage, with cold, wet conditions throughout spring and summer. Yields were way below national average too. One to avoid?	0.00650399923324585	The year of the earthquake, which struck Maule and Curicó on February 27. Mercifully, the growing season was already late, allowing producers to recover as best they could in time for harvest. Overall it was a cool year, best suited to varieties such as Sauvignon Blanc, Syrah, Chardonnay and Pinot Noir.	0.986247837543488	Lower yields than 2009, by about 20% overall. Quality is heterogenous thanks to some chaotic weather patterns, meaning that selectivity is the key to finding the best wines.	0.997492611408234	Botrytis was late and irregular this year, giving more delicate and restrained styles than in 2009 and featuring generally lower residual sugar with higher acidity.	0.0817503333091736	A return to the high acid norm after 2009, and some very good quality - especially in the Côte de Nuits - but volumes up to a third lower than average.	0.0443596839904785	A taxing year with dry conditions retarding grape development early in the season. When rain arrived in August it was torrential, causing widespread disease pressure. The return of dry conditions in September helped some producers over the line, but sorting in the vineyard and winery was crucial.	0.484902322292328	Good ripeness and concentration for Muscadet. Delightful Sauvignons too with good concentration and freshness. Late September rain created a bit of rot for the Cabernet Franc, with only the bravest growers waiting for full ripeness to occur – which it did, thanks to two lucky weeks of late sunshine. Chenins fared better in Cotreux du Layon than Vouvray, with the full range of sweetness being made.	0.999005198478699	A very successful vintage, with precision and freshness allowing great expression of terroir. Equally outstanding for whites and reds. Excellent.	0.999883830547333	Another stellar vintage, with higher tannin and more freshness than 2009 but comparable intensity. More appealing to classical palates.	0.999773919582367	Tremendous quality, combining the best weight of the 2009s with the lively freshness of the 2008s.	0.999872326850891	High acidity, after the more opulent style of the 2009s. A small, ripe crop - although a storm in early September did produce some rot, so sorting was crucial - as ever.	0.342934608459473	Quantity is down - again - but quality is good, with minimal rot thanks to dry, windy conditions in August and September.	0.998610734939575	Low yields of exceptionally good quality. One of the very best years in the northern Rhône - possibly the best in history!	0.999647915363312	A tricky, high-acid vintage, with low sunshine and high rain. Despite this, July was extremely hot, skewing the average temperature to well above average. Yields were devastated, but Riesling quality is nonetheless promising when in expert hands.	0.999127626419067	A wet spring caused irregular fruit set and was followed by an early summer with lots of rain. While Dolcetto suffered most from the short, cool growing season, Nebbiolo proved resilient thanks to its small berries and thick skins. August proved hot, but cool nights helped retain acidity. Some cooling rain in early September ensured a slow but steady development in the berries. Irregular fruit set meant that some producers had to do a severe selection during harvest, but the overall result is considered outstanding: a classic vintage with plenty of acidity, firm but ripe tannins and near-perfect balance in many wines.	0.999574184417725	Much cooler than the hot 2009. A very wet winter continuing into a very wet spring was followed by a cool growing cycle. The heat that came in July helped to reduce the delay in ripening that was by then an estimated 15 days behind schedule. Sangiovese was harvested as late as the third week of October and many producers had to do several pickings to obtain regularly ripe grapes in the fermentation tanks. Montalcino, exceptionally, was drier than other parts of Tuscany and the long and slow ripening of the grapes resulted in what is considered an outstanding vintage with true ageing potential for years to come.	0.995511651039124	Only produced 75% of average yields, but a very easy vintage otherwise. Sauvignon Blanc experienced particular concentration, while Pinot Noir was praised for its perfume and firm structure.	0.998132109642029	An exceptionally wet winter brought challenging erosion to the Douro, but welcome restoration of ground water. A very hot July then retarded ripening (because the vines shut down in the excessive temperatures) but the weather was more agreeable later in the season with good conditions for harvest and increased yields compared to 2008 and	0.994751572608948	Cool and dry in spring until a very wet November. December was dry again, and warm too, allowing for good late ripening. Mildew was a problem in many areas, so quality is variable.	0.987324714660645	Hot in early summer, becoming cooler toward the end, allowing slow and gradual ripening into autumn. Alcohol levels are rather lower than usual. Reds are better than whites.	0.856161057949066	Exceptional for Ribera del Duero with no excessive weather patterns, uniform ripeness and quality as promising as 2004. Good quality in Rioja also, considered better than 2009.	0.999788641929626	Ideal flowering conditions and a warm summer saw another early harvest with some growers having to pick Pinots early as sugars were getting too high. A very good year for both still and sparkling wines. Total vintage 4.05 m bottles off 1,095 hectares.	0.999705791473389	A very cool start to the season, then sudden heat in August followed by torrential rain. The net result is greatly reduced yields, but some very good quality wines in a more restrained, higher acidity and lower alcohol style than the Californian norm.	0.997909307479858
2009	For some, one of the best vintages of the decade in Mendoza. Winter was mild, spring was dry and summer was warm, with diurnal variation of over 15 ºC (27 ºF). Weather throughout harvest was very dry too, giving fruit in great condition.	0.998415410518646	A smaller vintage with another blistering heatwave to contend with. Opposite to 2008, the whites suffered most in 2009.	0.00545299053192139	NA	NA	Warm and healthy for whites, with Sauvignon Blanc and Chardonnay both achieving good quality levels. Certain red varieties suffered from dehydration again - Merlot most notably - and alcohol levels were high.	0.999815285205841	This year produced some of the most consistently healthy grapes ever in Alsace, translating into exemplary varietal character throughout the region.	0.999794244766235	Tremendous conditions for the sweet wines; plenty of heat and humidity at the right time have made fantastically rich and concentrated examples, with plenty of complexity and promise.	0.999885976314545	Finally, the Burgundians enjoyed a comparatively dry growing season with consistent warmth and no early season hail damage. Low acidity and ripe tannins should make these reds drinkable early.	0.974490165710449	After early complications a superb summer produced a clean crop of high quality, with particularly good Pinot Noir from the Montagne de Reims. Wines are plump and approachable.	0.999827861785889	A great vintage. Healthy fruit in Muscadet produced superb quality, especially from those growers prepared to keep yields under control. Touraine Sauvignon Blanc performed similarly well, with full phenolic ripeness and very little chaptalisation requirement, if any. Yields were slightly reduced in Sancerre and Pouilly-Fumé, and some July hail decimated much of Quincy, Reuilly and Coteaux du Giennois - but what was produced is excellent. Cabernet Franc enjoyed a late, dry harvest to make fully ripe reds, and Chenin was also very promising, although there botrytis was scarce.	0.999734699726105	Hot and dry throughout August, but decent levels of rainfall too, and plenty of wind to keep the vines healthy. Very satisfactory quality fruit at harvest. Impressive. Sometimes over-alcoholic.	0.999652326107025	'Vintage of the decade/century'? This growing season seemed to have it all. A long, fine, warm summer but, crucially, with refreshing nights to help retain acidity. Dramatically ripe, voluptuous wines, especially on the left bank.	0.999657809734344	Warm conditions led to full and fleshy whites with high alcohol but sufficiently balanced acidity, in most cases. Yields for Sauvignon Blanc were a bit lower than for Sémillon, compounded by severe hail in Entre-Deux-Mers and Graves, leading to some supply shortages.	0.187848746776581	Good, healthy and high quality across the region. Warm conditions and fairly large yields have given balanced grapes, and most agree 2009 whites are at least on a par with 2005.	0.999856173992157	A warm and smaller than average year, especially for whites. Quality is very high quality across the region.	0.999841570854187	Warmer and drier than average: volumes were down and harvest was early. Ripening was quick but complete, and quality looks to be very good.	0.9995978474617	Amongst the greatest vintages, 2009 is proving very alluring at a very early stage. The growing season was dry, warm and reliable. The wines are ripe and appealing but 12% down on volume compared to 2008.	0.999663889408112	A cold winter with lots of rain and snow delayed the start of the growing cycle. An unusually warm spring, however, encouraged a rapid budbreak and regular fruit set. It was still warm in June but a wet July increased fungal pressure in the vineyards and reduced yields in some cases. August was extremely hot and dry and the weather remained like this until mid September. The lack of rain caused water stress and vines to shut down. All this let to wildly irregular weather patterns throughout the region with some Barbera being picked before the early-ripening Dolcetto. Malic acid levels were overall below average, while the tannins did not always ripen fully. Quality is irregular, with excellence next to mediocrity, but hardly any of the wines show the stewed and dried-fruit flavours of the equally torrid 2003 vintage.	0.00279521942138672	Initially hailed as a great vintage but the wines, rich and at times jammy with high alcohol, have begun to betray the exceptionally hot summer as they develop in bottle. A very wet winter was followed by a regular spring with a very hot May, with temperatures up to 30 ºC, resulting in a swift flowering and fruit set. The vintage looked to be 10 days earlier than normal, until mid May brought 30 solid days of rain. August was extremely hot with day temperatures reaching 40 ºC, although nights were much cooler than in 2003, which helped to preserve the freshness in the grapes. While the 2009s overall showed richness of fruit with good acidity, in many cases a certain jamminess looks likely to affect their ageing ability.	0.991778314113617	Good quality throughout New Zealand, with dry conditions making for lovely, healthy, naturally balanced wines. Reds from Martinborough and Hawke's Bay were especially noteworthy.	0.999880790710449	An exceptionally hot summer led to an early vintage with great potential for Port, but extremely high alcohols in the unfortified wines, with some unripe tannins and shrivelled berries. Higher altitude sites will be crucial to making these wines work. A declared vintage.	0.996488749980927	Universal acclaim across all varieties.	0.999889850616455	NA	NA	Very hot conditions gave average temperatures above the infamous 2003 vintage. However, timely rains in Rioja and Ribera del Duero relieved the vines and rescued the vintage. Very good quality.	0.999801635742188	Very little spring frost, perfect flowering weather, rain at the right time and warm dry weather at the end of the season resulted in an early harvest with high sugars and balanced acids. Great year for both still and sparkling wines. Total vintage 3.18 m bottles off 946 hectares.	0.999708771705627	Good initial impressions of the fruit, with widespread reports of awesomeness, according to the winemakers, despite a very rainy end to the growing season giving rot problems to many.	0.999578297138214
2008	A very cold winter, a warm spring and a wetter than average autumn. Generally underpowered as a vintage, although reds were marginally better than whites.	0.963662445545197	An extremely hot year wreaked havoc with reds, but the earlier picked whites look to be good quality, and the Barossa’s oldest vines weathered the heat as they always have done.	0.987070322036743	NA	NA	A very cold and long winter, leading to considerable frost damage. Summer was then very hot and dry, leading to widespread drought. Dehydration was a problem, especially in Merlot and Cabernet Sauvignon.	0.00264370441436768	Challenging weather conditions looked ominous for Alsace this year, but the wines have turned out to enjoy good concentration with balancing high acidity. Quality is not as high as the 2007 vintage. The Crémants are amongst the best.	0.999556958675385	A pretty ignoble year for noble sweeties, unfortunately: yields were devastated by April frost. The pittance that remained, however, was high quality with plenty of botrytis influence.	0.997856438159943	An accursed vintage in Burgundy, with _coulure_, mildew and hail all conspiring to damage yields and quality. Late September sunshine went some way to rescue the crop, however, although high acidity remains the hallmark of this vintage.	0.0119428634643555	Initially a difficult, damp year with widespread mildew; drier conditions in August and a fine, warm September proved many producers’ saving grace. Classically styled wines with fresh acidity balanced by sound ripeness achieved late in the season.	0.999774158000946	A bad start to the growing year – cold and wet in early summer – with a dry but still cool July and August. Frost in Muscadet devastated yields, making for a very hard year for all growers. Sauvignon across the Loire experienced lower yields too, but displays good varietal typicality.	0.974940180778503	Quite gutless reds, thanks to the rain, although whites are worth a look.	0.0524124503135681	Another ungenerous summer saved by some better weather at the end of the season. Yet again, those properties at the top of the tree managed to field enough good fruit to salvage some pretty impressive grand vin but life was increasingly tough lower down the food chain.	0.00536346435546875	A cool growing season with late autumn sunshine gave well balanced whites to Bordeaux in 2008, with pure aromatic qualities and a steely austerity. Volume was affected by some hail and frost.	0.999714910984039	Challenging climatic conditions abounded throughout the season, leading to high acidity that gives these whites a particular freshness. Challenging, then, but as ever the best producers have made some spectacular wines.	0.99982887506485	Variable weather and drought in the summer made this a challenging year, but has created some concentrated, fruity and aromatic reds.	0.999371528625488	Lots of rain gave a disappointing and dilute vintage. Some producers opted not to make their top wines at all. Largely best to avoid.	0.00168895721435547	A very late-ripening vintage marked by cool autumn temperatures. Acidities are therefore high, and only the best-exposed sites produced truly great wines. Very few botrytis wines were made, but there was a reasonable crop of Eiswein.	0.996591150760651	Overshadowed by the plush 2007 wines from a hot vintage, 2008’s austerity was not immediately recognised as the stuff great vintages are made of. Although not without challenges to the growers, a long and cool growing cycle resulted in healthy, thick-skinned Nebbiolo grapes full of extract and high sugar levels, balanced by great acidity. Although in most cases the tannins are still unyielding, these powerful wines have all the ingredients for a significant gain in complexity and depth over years to come.	0.998281240463257	A relatively cool year with high diurnal temperature differences resulting in wines generally high in acidity and with firm tannins. The heterogeneity of finished wines suggests that this is a vintage in which the best terroirs shine. This seems to be true of Chianti Classico too, where the 2007s were initially considered greater. However, the best 2008s, especially the truly serious Riservas, should prove to have complexity as well staying power.	0.99934709072113	A lot of rot in Marlborough, meaning careful selection was required to make good Sauvignon Blanc. Not a distinguished vintage.	0.000355422496795654	A dry but, like 2007, cool year. Some growers picked early for fear of rain, but those that risked it were rewarded with ideal ripening conditions late in the season. Not universally declared, although Quinta do Noval have.	0.998857915401459	Lighter than average wines, thanks to an especially cool growing season. Not an easy vintage, but the slow ripening process led to elegant examples from the best producers.	0.999771952629089	NA	NA	Very good quality for Rioja, with favourable weather throughout autumn. In Ribera del Duero, temperatures were cooler than normal, giving a slow, balanced ripening process and elegant wines as a result.	0.999820590019226	NA	NA	Sonoma’s earliest harvest, and very early throughout northern California.	0.996748447418213
