V3	V5.ARGENTINA	V9.ARGENTINA	V5.SOUTH AUSTRALIA	V9.SOUTH AUSTRALIA	V5.AUSTRIA	V9.AUSTRIA	V5.CHILE	V9.CHILE	V5.ALSACE	V9.ALSACE	V5.BORDEAUX - SWEET	V9.BORDEAUX - SWEET	V5.BURGUNDY - RED	V9.BURGUNDY - RED	V5.CHAMPAGNE	V9.CHAMPAGNE	V5.LOIRE VALLEY	V9.LOIRE VALLEY	V5.SOUTHERN RHÔNE	V9.SOUTHERN RHÔNE	V5.BORDEAUX - RED	V9.BORDEAUX - RED	V5.BORDEAUX - WHITE	V9.BORDEAUX - WHITE	V5.BURGUNDY - WHITE	V9.BURGUNDY - WHITE	V5.LANGUEDOC-ROUSSILLON	V9.LANGUEDOC-ROUSSILLON	V5.NORTHERN RHÔNE	V9.NORTHERN RHÔNE	V5.GERMANY	V9.GERMANY	V5.PIEMONTE	V9.PIEMONTE	V5.TUSCANY	V9.TUSCANY	V5.NEW ZEALAND	V9.NEW ZEALAND	V5.PORT AND THE DOURO	V9.PORT AND THE DOURO	V5.SOUTH AFRICA	V9.SOUTH AFRICA	V5.CATALUNYA	V9.CATALUNYA	V5.RIOJA AND RIBERA DEL DUERO	V9.RIOJA AND RIBERA DEL DUERO	V5.ENGLAND	V9.ENGLAND	V5.NORTHERN CALIFORNIA	V9.NORTHERN CALIFORNIA
2017	Considered one of the best vintages in recent years, with generally warm and dry conditions. Cooler temperatures in the final two months lead to slightly lower alcohols and well preserved acidity. Even so, picking was generally earlier than the previous year, and while yields were higher than the small 2016 crop, volumes were still below the long-term average.	0.98812073469162	The grape harvest started later than in 2016, thanks to a relatively cool and wet start to the year, which brought disease pressure. There were none of the drought problems of recent years, and the crop was plentiful across all of Australia. Dry weather for most the harvest period ensured that quality was generally high too.	0.985922932624817	NA	NA	After severely damaging fires that raged across large areas of southern Chile in early 2017, the grape harvest started early in 2017. A generally warm year has produced ripe fruit flavours which can be jammy in some reds.	0.999521493911743	NA	NA	NA	NA	NA	NA	NA	NA	NA	NA	NA	NA	NA	NA	NA	NA	NA	NA	NA	NA	NA	NA	NA	NA	NA	NA	NA	NA	Wetter, cooler conditions than usual made for a late harvest with Marlborough Sauvignon Blanc expected to be perhaps more restrained than the norm. Volume was 9% lower than in 2016.	0.00109463930130005	NA	NA	Very good quality potential across the Western Cape, thanks to dry conditions throughout harvest and very little disease pressure. Many regions experienced drought conditions, resulting in a smaller-than-usual crop, but offering greater concentration of both colour and flavour as a result.	0.999272108078003	NA	NA	NA	NA	Better yields than in 2016, though frost damage affected many vineyards in the south-east of England. Sugar levels were good at harvest, thanks to some hot spells in June and a mostly dry harvest period, and acid levels were mostly well-balanced too. Total harvest 4.5 m bottles off 2,275 hectares.	0.997633635997772	NA	NA
2016	A rain- and hail-affected vintage made for unusually challenging conditions. It was also one of the coolest vintages on record, according to Bodega Catena Zapata, which had the advantage of restricting the spread of rot and resulted in atypically modest alcohol levels. Overall, though, yields are lower and quality is by no means reliable. Gualtallary is thought to be one of the regions that escaped the worst impact of the excess precipitation.	0.0156239867210388	Another very early vintage, with most varieties and regions finished with harvest by mid-February. That has allowed for lower alcohols in regions such as Coonawarra, but the warm summer allowed for full flavour ripeness. It was a compressed and difficult vintage to produce, but the results should be promising. For a more detailed report, read Max Allen’s article.	0.993307173252106	Officially described as 'outstanding quality, characterised by particularly delicate fruit-driven aromatics and fresh acidity,' early signs of quality are good. Yields in Steiermark and Burgenland were reduced by frost and hail in April - in the former region by up to 80%. Then a wet summer gave rise to plentiful mildew, although conditions in early autumn were much more favourable and the resultant wines are thought to be of good quality, though not destined for long ageing.	0.999699413776398	An El Niño year generated an unusual amount of rain, especially in Casablanca, Rapel, Maipo and Colchagua. Red varieties were most affected, as the worst of the rain came after most whites had been harvested. The result is a 25% reduction in yield and very variable quality. The only saving grace may be lower alcohol and fresher acidity in the best wines.	0.0361543893814087	Managing to escape the hail and frost that beset other French regions meant that Alsace had good yields in 2016. However, during a wet June mildew was a potential problem, but the rest of summer was warm and dry. Harvest conditions were good, and the resultant wines are more elegant and classic in profile than the richer 2015s.	0.99969869852066	Generally lighter than the top vintages, the best sweet Bordeaux in 2016 are refreshing and zesty but not hugely complex. Noble rot came quite late in the season, and some fruit had already been picked when it arrived. Therefore, some of the wines are characterised by raisined flavours rather than the mushroom and marmalade notes of great botrytised whites.	0.987945139408112	Hail, frost and mildew all made 2016 an extremely difficult year for makers of red burgundy. Yields were universally low, and the fruit had less concentration than in 2015. Beyond that, generalisations are impossible due to the complicated meteorological patterns throughout the year, creating very varied conditions in each sub-region.	0.00251179933547974	As happened widely across France, frost and hail conspired to lower the yields in the Champagne region in 2016. Quality is generally above average, with Pinot Noir preferred to Chardonnay. The vintage is likely to be declared for several luxury cuvées, including Cristal and Comtes de Champagne.	0.679090976715088	Once again, frost caused significant crop loss in the Loire Valley, especially in Muscadet. Quality and concentration is good, with Chenin Blanc being particularly noteworthy in 2016 while Sancerre is thought to be the best of the Sauvignon Blanc appellations. Cabernet Franc is 'delicious, ripe and fruity' according to Loire courtier Chris Hardy.	0.999825239181519	According to Michel Chapoutier, 2016 could be better than 1990 in the southern Rhône – praise indeed. Warm conditions throughout the year along with reduced yields has resulted in wines of great concentration – in colour, tannin and flavour. Certainly one of the great vintages, for reds anyway.	0.999357044696808	The quality of red Bordeaux in 2016 was universally lauded – although the response to the en primeur campaign was muted. Quantity was high too, with the equivalent of 770 million bottles of wine produced. An exceptionally dry summer with cool nights eventually, thanks to mid September rain, resulted in small, thick-skinned, ripe grapes, and the wines are marked by high tannin and acidity, with superb aromatic fragrance.	0.999674916267395	Unlike its red counterparts, dry Bordeaux white was rarely thrilling in 2016. Stylistically, they tend to be slightly lower in alcohol and acidity than the 2015s, with less expressive flavours. By no means a bad vintage for whites, but most certainly better for reds.	0.00316649675369263	Damaging hailstorms and frost meant that yields are down across the region, by as much as 50% in Chablis. However, what remains is considered good quality in a classic style – that is, without any particular extremes of acid, alcohol, body or fruit concentration.	0.986116826534271	Generally warm and sunny throughout the summer with usefully fresh nights, though some regions suffered through lack of rainfall, resulting in smaller yields of concentrated juice. However, these dry conditions did at least result in reduced disease pressure, and quality is generally good across reds and whites, with high flavour intensity.	0.999775350093842	Hail in April damaged some of the crop in Hermitage, meaning yields are reduced – though quality isn’t necessarily compromised. Indeed, there is a lot of enthusiasm for both reds and whites, despite some tricky weather throughout the year. Alcohol levels are in general slightly lower than in 2015.	0.213817298412323	High rainfall in early summer created serious disease pressure, especially in Nahe and Mosel. What with late frost and hail, prospects for the 2016 harvest did not look good. However, the weather improved from July onwards and the overall quality is good, while the wines tend to be lower in alcohol and higher in acidity than 2015.	0.969822347164154	Piemonte produced excellent quality wine in 2016, with ripeness to match the very good 2015 but firmer tannin and higher acidity. Ideal harvest conditions allowed the Nebbiolo to ripen fully, and yields were higher than average too. Arneis also fared well, producing precise, juicy white wines.	0.999682366847992	Another good vintage in Tuscany has produced wines with deep colour and impressive fragrance. However, yields were down by up to a fifth compared to the average. Chianti Classico enjoyed particularly good quality fruit.	0.999702930450439	A welcome increase of volume produced after the small 2015 vintage. Martinborough had excellent weather conditions throughout the year, and is likely to fare better than Central Otago. In Marlborough, larger than average berry size is expected to emphasise thiols (passionfruit flavours) over methoxypyrazines (herbal flavours).	0.999539315700531	A cold and wet spring made for a tough start to the year, and yields were lower than average as a result. Some very hot spells followed, retarding the ripening process as the vines shut down. Thankfully, the autumn was mostly dry, allowing for a long harvest to ensure optimum ripeness and the wines are rich, complex and intense.	0.990313172340393	The smallest crop in half a decade has resulted in concentrated, ripe wines. The hot conditions demanded an early harvest, which means alcohol levels are generally lower than average. Sunburn was a problem in some regions, but there was at least minimal threat of rot thanks to very dry weather throughout the season.	0.100528180599213	Drought conditions throughout the year led to low yields across Catalunya. The small berries have resulted in very high intensity, with local grape varieties generally performing better than international varieties. Quality is good, even if yields were not.	0.999649107456207	Unlike Catalunya, Rioja enjoyed an abundant harvest – the largest since 2005, and many producers had to discard fruit to meet the permitted yield. Quality is excellent, with modest alcohol, full ripeness, relatively light tannins, good aromatic range and no bitterness. In Ribera del Duero, the outlook is also positive, with quality as good as the strong 2015 vintage.	0.999835789203644	Very low yields made things difficult for many producers, but quality was at least generally good. The eastern part of England had the better weather, and ripeness reached record levels in many cases. Total harvest 4.15 m bottles off 2,100 hectares.	0.999091327190399	While Europe suffered from frost and hail, northern California experienced very heavy rainfall in autumn 2016. While that partially relieved the extended drought status of the region, it also caused some flood damage. Cooler than normal temperatures in August allowed for a steady, gradual ripening, which has produced wines of very good complexity, and higher-than-average natural acidity.	0.999137163162231
2015	A tricky year for the main region, Mendoza, with warmth and humidity bringing rot, and hail affecting some areas too. The best producers had to be meticulous in their selection, and lesser wines are likely to suffer from the poor conditions.	0.0270881652832031	Bush fires in the Adelaide Hills area may result in some smoke-tainted wines. Coonawarra had a warm spring but a cooler summer allowing for slow development and notably high tannin in the Cabernet Sauvignon. Barossa Shiraz enjoyed an excellent vintage while Clare Valley growers are enthusiastic about the quality of their Riesling.	0.980902791023254	After the challenges of 2014, the 2015 harvest was far better. It was generally warm across the country, creating flavourful wines from all varieties. Both whites and reds are expected to display strong typicality with fuller-than-average body.	0.999594628810883	A very early harvest after higher-than-average temperatures throughout the seasons translated into lower acidity levels, requiring attentive handling in the winery to achieve balance.	0.0265859961509705	Much easier than recent vintages. After a gloomy June the summer was scorching, resulting in a harvest that began very early in September, and in lower acid levels than usual. Pinot Noir was particularly successful. Healthy harvest conditions allowed many producers to make late-harvested sweet wines. Overall, yield was small for the third year in a row.	0.997956693172455	Botrytis affected vineyards evenly and quickly in-between late autumn rains, resulting in very promising harvests. Quality looks to be very good indeed.	0.99947190284729	Low yields and warm weather allowed for ample ripeness, small berries and an early harvest. Quality is looking extremely fine, with some people whispering comparisons with the outstanding 2005 vintage. Acid levels in individual wines may be crucial.	0.999188959598541	Very little disease pressure, thanks to dry, sunny conditions over the summer months – the driest on record. Rain arrived in the final week of harvest, but most grapes had already been gathered. The berries tended to be small but with good uniform ripeness, and potential alcohol levels were relatively high at harvest. Richness should characterise the vintage, and Pinot Noir did particularly well. Some excellent vintage champagne should be produced.	0.999471187591553	Very promising across the region, with the same warm, dry summer that many other French regions enjoyed. In Muscadet, some rain towards the end of harvest resulted in a little rot, but nothing too concerning. Touraine saw very low yields but excellent quality, as did Sancerre and Pouilly-Fumé. Pinot Noir reached full ripeness, and very promising quality, for all those growers prepared to wait. Chenin Blanc also fared well, with the potential to make good wine at all sweetness levels.	0.999715387821198	Grenache suffered from coulure at flowering, meaning lower yields but the quality is extremely promising. Alcohol levels are likely to be higher than in the two previous vintages.	0.999408423900604	Will this vintage adhere to Jancis’ rule of five, whereby any vintage divisible by five is of good quality? It seems so, with particularly healthy, uniform fruit at harvest. A generous flowering and hot, dry early summer was followed by a slighty cooler, damper August. Harvest was generally earlier than in 2014. Optimists are already calling it the best vintage since 2010 with early reports favouring the right bank.	0.999556541442871	Rain in August cased more problems for the thin-skinned Sémillon than Sauvignon Blanc. This is likely to be reflected in the final blends.	0.0722342133522034	An early vintage with a very warm, dry summer. Chablis was affected by hail in early September, damaging 300 hectares of vineyard. Lower acidity levels make the wines richer but less precise than the 2014s.	0.720395445823669	The harvest began on 7 August. The hot weather produced plentiful ripeness, and potential quality is considered to be very promising at the top end.	0.999173045158386	Universally viewed as a vintage with top quality potential. Guigal will produce their special Condrieu cuvée Luminescence for only the third time (previous vintages were 1999 and 2003). For reds, maintaining freshness and avoiding over-extraction is the key to quality with such ripe fruit.	0.999736487865448	Yields across the country met the ten-year average, though they varied from region to region. In the Mosel, for instance, quality is especially promising but yields were 8% down on 2014. The Rheingau is also tipped for excellence, while reds from Baden are expected to be powerful and dark.	0.027718722820282	An exceptional vintage thanks to healthy grapes and exceptionally regular bunches. A very cold winter with plenty of snow and a protracted cool and rainy spring replenished the water tables, much needed during a July that was the hottest ever on record. The vintage shows great promise, even if some grapes were relatively low in acidity.	0.999785363674164	A cold and rainy winter preceded an irregular spring followed by exceptionally hot, dry summer weather, creating small bunches of Sangiovese, so yields were down across the region – exacerbated by several violent August hailstorms – although concentration levels are very good.	0.247038304805756	Marlborough enjoyed a very dry summer, resulting in wines with greater concentration than 2014 and yields were down 20-25%. Central Otago enjoyed plenty of ripeness in the Pinot Noir.	0.202362060546875	Overall, a dry and warm year in the Douro, but with enough rainfall at the right times to keep the vines in good condition. Disease pressure was low and the harvest was earlier than average. Flavour ripeness is impressive across all varieties, but acidity levels are fairly low, as are yields. Most producers are confident of making great vintage ports in this vintage.	0.996557354927063	Record early harvest but viewed as good quality by most observers, thanks to clement weather throughout the year. Yields are slightly lower than in 2014.	0.927042901515961	Priorat and Montsant escaped the harvest rains unscathed in 2015, and producers are very enthused about the quality. Potentially the best harvest of the last five years.	0.999756455421448	Ribera was hot and dry in 2015. Old vines did well while younger vines struggled. Volume was lower than in 2014 by up to one third. Low nitrogen levels led to some struggling ferments, but the flavour ripeness is very high, with soft tannins and high potential alcohol. Alcohol will also be higher than usual in Rioja, again with powerful concentration and richness. A short, early harvest reflected the ripeness of the crop. Berries were small across the region, with the higher, cooler vineyards of Rioja showing especially high quality.	0.999279022216797	A frost-free spring led to a cool spring. Flowering weather was very good, but two weeks late, and with a cool summer, characterised by untypical cool nights, grapes were slow to develop. August and most of September were cooler than average and many growers were despairing of harvesting later varieties. However, a good end to September and an exceptionally warm October saved growers and most picked good yields of healthy grapes. Altogether a very good year for both still and sparkling wines, although Chardonnay based sparkling wines will want long ageing. Total harvest estimated to be 4.5 m bottles off 1,600 hectares.	0.996170043945312	In common with much of Europe, the harvest started early in California – as early as July for some growers of sparkling wine. Yields are almost universally down on 2014. Huge wildfires proved a challenge for many, causing damage to vineyards and property as well as threatening smoke taint, especially in Lake County.	0.0162191987037659
