	index	year	region	review	sentiment	score
217	217	2004	SOUTHERN RHÔNE	A little sterner than the 2006s but similar in style.	POSITIVE	0.9762783050537109
218	218	2003	SOUTHERN RHÔNE	Excessive heat had fewer ill effects in this hot region than in the (usually) more temperate climes of Bordeaux and Burgundy. But the wines tend to be low in tannin and high in acid and only the best have the balance to last.	NEGATIVE	0.9853692054748535
219	219	2002	SOUTHERN RHÔNE	So wet that there was flood damage just before harvest. Much downgrading of fruit into humbler bottlings than usual.	NEGATIVE	0.9989725947380066
220	220	2001	SOUTHERN RHÔNE	Lauded vintage, the result of a very hot, dry summer. An unusually prolonged _mistral_ at the end of August resulted in thick-skinned berries and accentuated tannins. Later harvesting resulted in better balanced wines - especially in higher-yielding vineyards - but acid levels are dangerously low in some cases. There should be some very long-lived top wines however.	POSITIVE	0.974432110786438
221	221	2000	SOUTHERN RHÔNE	Conditions were excellent until quite heavy rains arrived on 19 September. The results, especially from those who picked early and fast, are plump, approachable wines capable of giving great pleasure even if they will not be the longest-lasting.	POSITIVE	0.9997345805168152
222	222	1999	SOUTHERN RHÔNE	Rather more challenging vintage than 2000 for growers and wines with less obvious richness than 1998 for wine drinkers. Heavy rains plagued the harvest and quality is distinctly variable.	POSITIVE	0.8271530866622925
223	223	1998	SOUTHERN RHÔNE	Much garlanded vintage that struggled to live up to its reputation during its teenage years.	NEGATIVE	0.9816007018089294
224	224	1997	SOUTHERN RHÔNE	Rather muddy flavours from well ripened grapes.	NEGATIVE	0.9771124720573425
225	225	1996	SOUTHERN RHÔNE	Coolish, damp summer produced lighter-than-usual wines.	POSITIVE	0.9992660880088806
226	226	1995	SOUTHERN RHÔNE	Very good colour and really ripe, concentrated reds. Some producers claim it is better than 1990.	POSITIVE	0.9997612237930298
227	227	1994	SOUTHERN RHÔNE	Early harvesters were luckier, most picked in rain, so only average quality.	NEGATIVE	0.9883246421813965
228	228	1993	SOUTHERN RHÔNE	An unwelcome repeat of 1992's weather: diluted, easy-drinking wines.	NEGATIVE	0.9967139363288879
229	229	1992	SOUTHERN RHÔNE	Torrential harvest rains drowned the vineyards and the results are pretty dilute.	NEGATIVE	0.9995827078819275
230	230	1991	SOUTHERN RHÔNE	The Grenache failed at flowering and harvest time was uninspiring. Best forgotten.	NEGATIVE	0.9997298121452332
231	231	1990	SOUTHERN RHÔNE	Exceptionally sumptous, powerful and heady wines with fairly low acidity. Only the finest survive.	POSITIVE	0.998403012752533
232	232	1989	SOUTHERN RHÔNE	Fabulously concentrated with perhaps more backbone than 1990.	POSITIVE	0.9991333484649658
233	233	1988	SOUTHERN RHÔNE	Good in all areas: full bodied and with firm tannins, often termed 'classic'.	POSITIVE	0.9998451471328735
234	234	1987	SOUTHERN RHÔNE	Pretty poor generally, cool and wet weather with thin wines the result.	NEGATIVE	0.9995744228363037
235	235	1986	SOUTHERN RHÔNE	Mostly picked before the rains, these were firm and tannic in their youth.	POSITIVE	0.9961308836936951
236	236	1985	SOUTHERN RHÔNE	Charming and ripe, even opulent, and now quite soft.	POSITIVE	0.9998633861541748
237	237	2016	BORDEAUX - RED	The quality of red Bordeaux in 2016 was universally lauded – although the response to the en primeur campaign was muted. Quantity was high too, with the equivalent of 770 million bottles of wine produced. An exceptionally dry summer with cool nights eventually, thanks to mid September rain, resulted in small, thick-skinned, ripe grapes, and the wines are marked by high tannin and acidity, with superb aromatic fragrance.	POSITIVE	0.999674916267395
238	238	2015	BORDEAUX - RED	Will this vintage adhere to Jancis’ rule of five, whereby any vintage divisible by five is of good quality? It seems so, with particularly healthy, uniform fruit at harvest. A generous flowering and hot, dry early summer was followed by a slighty cooler, damper August. Harvest was generally earlier than in 2014. Optimists are already calling it the best vintage since 2010 with early reports favouring the right bank.	POSITIVE	0.9995565414428711
239	239	2014	BORDEAUX - RED	Exceptionally cool, damp July and August but the vintage was saved by an unusually dry, warm September and October that (just about) ripened the grapes though autumn concentration has resulted in relatively high-acid wines. Reds have fragrance, medium body and supple tannins but are not for long term cellaring.	POSITIVE	0.9817661046981812
240	240	2013	BORDEAUX - RED	A universally poor vintage, beset by uneven ripening and dilution. Rot forced relatively early picking. Even at their best, the wines are pretty light – though perhaps a benefit of this is lower alcohol levels, as compared with some of the 15% bruisers of recent years. The best of a bad lot can be found in Pomerol, St-Julien and St-Estèphe.	NEGATIVE	0.9410597681999207
241	241	2012	BORDEAUX - RED	Tricky across many European wine regions, and none more so than Bordeaux. Generally speaking, it was a wet, late year with a hot mid-summer. Bad weather in October compromised quality at the crucial moment, meaning that the earlier-ripening Merlot-based reds were less adversely affected. Making good Cabernet-based wine was achievable, but only by those who had the resources for micro-management in the vineyard. Top properties made small quantities of outstanding wines but most have a lack of depth and persistence.	NEGATIVE	0.9885944724082947
242	242	2011	BORDEAUX - RED	Generalisations are difficult in this variable year, but there is agreement that quality is back down to earth after the excitement of 2009 and 2010, with lower alcohol and generally higher tannins too. A forgettable year.	NEGATIVE	0.9865527153015137
243	243	2010	BORDEAUX - RED	Another stellar vintage, with higher tannin and more freshness than 2009 but comparable intensity. More appealing to classical palates.	POSITIVE	0.9997739195823669
244	244	2009	BORDEAUX - RED	'Vintage of the decade/century'? This growing season seemed to have it all. A long, fine, warm summer but, crucially, with refreshing nights to help retain acidity. Dramatically ripe, voluptuous wines, especially on the left bank.	POSITIVE	0.9996578097343445
245	245	2008	BORDEAUX - RED	Another ungenerous summer saved by some better weather at the end of the season. Yet again, those properties at the top of the tree managed to field enough good fruit to salvage some pretty impressive grand vin but life was increasingly tough lower down the food chain.	NEGATIVE	0.9946365356445312
246	246	2007	BORDEAUX - RED	An extremely difficult year for growers, with rampant mildew, not enough sun, too much rain until September. Thanks to an arsenal of modern techniques, not least rigorous selection, those who could afford it managed to make attractive wines for relatively early drinking but high prices left the primeur market as flat as a pancake.	NEGATIVE	0.9975366592407227
247	247	2006	BORDEAUX - RED	This stop-start vintage suffered inevitably by comparison with 2005, although it produced some well-made wines which looked even better in comparison with the 2007s. Drought and high temperatures were the dominant characteristics until the end of July but August was unusually cool and wet and harvest was interrupted by rain. Pauillac and Pomerol seemed to perform best in a year that can taste pretty crisp.	NEGATIVE	0.9299901127815247
248	248	2005	BORDEAUX - RED	Textbook perfection during the growing season in all respects other than price. Best kept for many a year. Quite marked tannins are too marked in some wines, notably the more modernistic St-Émilions, in which the then-prevailing fashion for extraction was taken to the limit.	POSITIVE	0.7803164720535278
249	249	2004	BORDEAUX - RED	The last affordable vintage? Large, late crop needed meticulous summer supervision. Grapes were often picked in the rain but healthy at the top end. Not massive but the best really are that rare breed, classic claret. Best on the left bank where sappy tannins suggest they might be ready to enjoy from 2010.	POSITIVE	0.9904187321662903
250	250	2003	BORDEAUX - RED	Exceptional heatwave resulted in many raisined grapes and uncomfortably dry tannins. A handful of stunning wines for the long term but most are probably best drunk while the bloom of youth can distract from that dryness.	NEGATIVE	0.6906928420066833
251	251	2002	BORDEAUX - RED	Smallish crop dogged by an uneven flowering and a grey, humid summer which meant uneven ripeness in far-from-uniformly healthy grapes. Growers concentrated on the rescue effect of pretty fine weather from 9 September. The wines are correct and, in a 21st-century context, are not expensive, but they may not last all that long.	NEGATIVE	0.8814252614974976
252	252	2001	BORDEAUX - RED	Extremely varied, large crop which depended on crop-thinning and extremely careful selection to produce exceptional wines. Hot August was followed by dangerously wet September, which sometimes resulted in dilute Merlots and tart Cabernets. Some good value to be found here, and with time the 2001s showed better and better - especially on the right bank where it can be superior to 2000.	POSITIVE	0.9915589690208435
253	253	2000	BORDEAUX - RED	Nature's benevolence coincided with the commercial imperative to have a good vintage in this numerically exceptional year. Great consistency and balance. The petits châteaux represented some of Bordeaux’s best value for many years though most are ready to drink or even starting to decline. The best wines should last well into their second or even third decades.	POSITIVE	0.9996687173843384
254	254	1999	BORDEAUX - RED	Good potential created almost exclusively by three weeks of sunshine from late August was diluted by rain at harvest time. Hail also devastated some St-Émilion vineyards in early September. A cool, humid start to the growing season led to excessive vegetation initially. Fairly early maturing wines with better potential on the left bank.	NEGATIVE	0.9431099891662598
255	255	1998	BORDEAUX - RED	Very good on the right bank but a less starry performance in the Médoc, whose 1998s are a bit stolid, means that these wines, and their equally successful counterparts in Graves have tended to be overlooked.	NEGATIVE	0.8096712231636047
256	256	1997	BORDEAUX - RED	Far from dramatic and early developers, these wines were ludicrously overpriced initially but provided some easy drinking in the early years of this century. Few show any possibility of improvement.	NEGATIVE	0.9722697138786316
257	257	1996	BORDEAUX - RED	Some very fine, potentially long lived wines, especially in the Médoc, although robust tannin levels recall 1986s in many cases.	POSITIVE	0.9977223873138428
258	258	1995	BORDEAUX - RED	Hot, dry summer resulted in early harvest of healthy Merlot grapes. Relatively tannic Cabernet Sauvignon was picked after a week of mid-September rain. Generous crop levels, best in Pomerol and Pauillac.	POSITIVE	0.9994897842407227
259	259	1994	BORDEAUX - RED	The best year since 1990 (which is not saying that much). Nicely ripe but September rains were a problem again for less conscientious producers.	POSITIVE	0.9967477321624756
260	260	1993	BORDEAUX - RED	Another wet harvest. Picked earlier, the right bank a better bet than the left.	NEGATIVE	0.9978569746017456
261	261	1992	BORDEAUX - RED	Light, fruity, simple wines that needed drinking early.	POSITIVE	0.999701201915741
262	262	1991	BORDEAUX - RED	The start of Bordeaux's run of bad luck. Spring frosts decimated the right bank, but the top Médocs are not bad.	POSITIVE	0.9975840449333191
263	263	1990	BORDEAUX - RED	Second scorching year in a row. Very ripe, alluring wines at all levels, many outstanding. The vintage character of velvety texture and luscious, almost overripe fruit is one of the easiest to spot and tends to impose itself over any geographical characteristics.	POSITIVE	0.9968037605285645
264	264	1989	BORDEAUX - RED	Seemed an unusually hot summer at the time, producing a huge crop of rich, opulent, expensive wines, drinking astonishingly well young. Some very good right bank wines indeed. And an exceptional year for Haut-Brion.	POSITIVE	0.9997782707214355
265	265	1988	BORDEAUX - RED	Overshadowed by 1989 and 1990. 'Classic' style ie firm and initially a bit austere. Chunky and chewy.	NEGATIVE	0.9968993663787842
266	266	1987	BORDEAUX - RED	Simple, fruity and pleasant but unexciting. Early maturing.	POSITIVE	0.9997666478157043
267	267	1986	BORDEAUX - RED	Dense, brooding and viciously tannic at first. Some may impress in the end but have required enormous patience.	NEGATIVE	0.9819429516792297
268	268	1985	BORDEAUX - RED	Uniformly lovely, fragrant wines especially but not exclusively from the right bank. They drank well for years but most are losing fruit or showing slight herbaceousness now.	NEGATIVE	0.8337414264678955
269	269	1983	BORDEAUX - RED	Good but less concentrated and opulent than 1982. Their lesser amount of stuffing meant that most have peaked although it was a banner year for Margaux for once.	POSITIVE	0.5833286643028259
270	270	1982	BORDEAUX - RED	Legendary year, the first of the modern era. Horribly expensive but very concentrated and so delicious. The best are still going very strong.	POSITIVE	0.9998877644538879
271	271	1981	BORDEAUX - RED	Patchy quality, with a lack of guts but attractive balance. Most are well over the hill.	POSITIVE	0.9964606165885925
272	272	1979	BORDEAUX - RED	Graceful, suave and well-balanced for a time but they should have been drunk in the 20th century.	POSITIVE	0.969074010848999
273	273	1978	BORDEAUX - RED	A perfect autumn saved the crop. The big left bank names are strongest.	POSITIVE	0.9998123049736023
274	274	1975	BORDEAUX - RED	Frequently overwhelmed by dry tannins. A few Pomerols and Pauillacs are huge and magnificent.	POSITIVE	0.9997228384017944
275	275	1970	BORDEAUX - RED	These firm, sturdy wines, very much of their era, have lasted well but are generally pretty short on flesh.	NEGATIVE	0.994897723197937
276	276	2016	BORDEAUX - WHITE	Unlike its red counterparts, dry Bordeaux white was rarely thrilling in 2016. Stylistically, they tend to be slightly lower in alcohol and acidity than the 2015s, with less expressive flavours. By no means a bad vintage for whites, but most certainly better for reds.	NEGATIVE	0.9968335032463074
277	277	2015	BORDEAUX - WHITE	Rain in August cased more problems for the thin-skinned Sémillon than Sauvignon Blanc. This is likely to be reflected in the final blends.	NEGATIVE	0.9277657866477966
278	278	2014	BORDEAUX - WHITE	Searing acidity is the hallmark of many of these wines, some of which are exceptionally pleasing. Plenty of others, however, are relatively new creations and remain works in progress.	POSITIVE	0.9998296499252319
279	279	2013	BORDEAUX - WHITE	As with the reds in 2013, there is a lightness to Bordeaux’s Sémillon/Sauvignon Blanc blends – though this is not an entirely bad thing.	POSITIVE	0.998949408531189
280	280	2012	BORDEAUX - WHITE	Far better for dry whites than their sweet siblings – in fact, they are one of the notable successes of the vintage. Pessac-Léognan and Graves are both good, with more ‘liveliness’ than the average vintage.	POSITIVE	0.9998642206192017
281	281	2011	BORDEAUX - WHITE	Some real energy and excitement in dry whites.	POSITIVE	0.9987635016441345
282	282	2010	BORDEAUX - WHITE	Tremendous quality, combining the best weight of the 2009s with the lively freshness of the 2008s.	POSITIVE	0.9998723268508911
283	283	2009	BORDEAUX - WHITE	Warm conditions led to full and fleshy whites with high alcohol but sufficiently balanced acidity, in most cases. Yields for Sauvignon Blanc were a bit lower than for Sémillon, compounded by severe hail in Entre-Deux-Mers and Graves, leading to some supply shortages.	NEGATIVE	0.8121512532234192
284	284	2008	BORDEAUX - WHITE	A cool growing season with late autumn sunshine gave well balanced whites to Bordeaux in 2008, with pure aromatic qualities and a steely austerity. Volume was affected by some hail and frost.	POSITIVE	0.9997149109840393
285	285	2007	BORDEAUX - WHITE	The season’s low temperatures benefited these dry whites, as in 2006. With white winemaking improving each year, dry whites were Bordeaux’s real triumph in 2007.	POSITIVE	0.9997014403343201
286	286	2006	BORDEAUX - WHITE	The cool August preserved acid levels and fruit in these wines, which deserve serious attention.	POSITIVE	0.9983423948287964
287	287	2005	BORDEAUX - WHITE	Very concentrated successful wines in general. Some run slightly to fat.	NEGATIVE	0.942030131816864
288	288	2004	BORDEAUX - WHITE	A long growing season and cool September nights, along with increasing white winemaking skill, produced a good tally of wines with impressive acid levels – a relief after 2003.	POSITIVE	0.9998120069503784
289	289	2003	BORDEAUX - WHITE	Acid levels were dangerously low in the heatwave. For very early drinking except for the very finest.	NEGATIVE	0.9695304036140442
290	290	2002	BORDEAUX - WHITE	Small crop of concentrated, fragrant wines.	POSITIVE	0.9993032813072205
291	291	2001	BORDEAUX - WHITE	The low temperatures of September helped maintain freshness and produced well-etched, fruity flavours with good acidity.	POSITIVE	0.9998528957366943
292	292	2000	BORDEAUX - WHITE	Summer was if anything too hot to produce nervy wines and most of these were best drunk young, although there are one or two great wines at the top of the tree.	NEGATIVE	0.9495542049407959
293	293	1999	BORDEAUX - WHITE	Some attractive, aromatic Sauvignon Blanc was harvested but the Sémillon fruit was often dilute.	NEGATIVE	0.9973531365394592
294	294	1998	BORDEAUX - WHITE	Attractive wines with no shortage of ripeness.	POSITIVE	0.9998205304145813
295	295	1997	BORDEAUX - WHITE	Rather lacklustre without much depth or personality.	NEGATIVE	0.9998092651367188
296	296	1996	BORDEAUX - WHITE	Like most French 1996 whites, vivacious, crisp wines.	POSITIVE	0.9997819662094116
297	297	1995	BORDEAUX - WHITE	Lots of body and flavour and structure thanks to the warm summer wherever grapes were picked before the mid-September rains.	POSITIVE	0.9995929598808289
298	298	1994	BORDEAUX - WHITE	Potentially superb as fully ripe grapes were again gathered before the rains.	POSITIVE	0.9992694854736328
299	299	1993	BORDEAUX - WHITE	Avoided the rains: generally good, soft and full, sometimes outstanding.	POSITIVE	0.9998461604118347
300	300	1992	BORDEAUX - WHITE	Clearly better than the reds, the best are intense and well-structured.	POSITIVE	0.9998764991760254
301	301	1991	BORDEAUX - WHITE	A difficult year, rather light and most are just too dilute to be interesting.	NEGATIVE	0.9982307553291321
302	302	1990	BORDEAUX - WHITE	Mostly richer, fuller and more complex than 1989, but not very long-lived.	POSITIVE	0.996472954750061
303	303	1989	BORDEAUX - WHITE	Picked too soon, generally light and not a patch on the reds except for Laville-Haut-Brion and Haut-Brion.	NEGATIVE	0.9892269968986511
304	304	2016	BURGUNDY - WHITE	Damaging hailstorms and frost meant that yields are down across the region, by as much as 50% in Chablis. However, what remains is considered good quality in a classic style – that is, without any particular extremes of acid, alcohol, body or fruit concentration.	POSITIVE	0.9861168265342712
305	305	2015	BURGUNDY - WHITE	An early vintage with a very warm, dry summer. Chablis was affected by hail in early September, damaging 300 hectares of vineyard. Lower acidity levels make the wines richer but less precise than the 2014s.	POSITIVE	0.7203954458236694
306	306	2014	BURGUNDY - WHITE	Rather promising wines have emerged from a season that started unusually early after a mild winter and usefully wet early March followed by a very dry spring. Weather during flowering was almost too hot and dry. A cool, damp summer slowed ripening so that a fair quantity of grapes with good acid levels were picked at the usual time.	NEGATIVE	0.9771908521652222
307	307	2013	BURGUNDY - WHITE	A disappointment to Burgundy’s Chardonnay growers who had hoped for higher volumes than 2012. Instead, a short crop thanks to the cold spring was diminished still further by the careful fruit selection required after an erratic summer. All in all, producers intent on quality have acquitted themselves well.	NEGATIVE	0.986737072467804
308	308	2012	BURGUNDY - WHITE	Produced very low volumes of Chardonnay in Burgundy. What there is, however, is being welcomed with cautious enthusiasm. As with the reds, poor quality was expected after such challenging weather conditions, but the first tastings indicated the wines are very good. A triumph against adversity, perhaps?	POSITIVE	0.9994081258773804
309	309	2011	BURGUNDY - WHITE	Less ripe than the previous two vintages, needing chaptalisation in many cases. Chaotic weather made this a tricky vintage overall.	NEGATIVE	0.9927607178688049
310	310	2010	BURGUNDY - WHITE	High acidity, after the more opulent style of the 2009s. A small, ripe crop - although a storm in early September did produce some rot, so sorting was crucial - as ever.	NEGATIVE	0.6570653915405273
311	311	2009	BURGUNDY - WHITE	Good, healthy and high quality across the region. Warm conditions and fairly large yields have given balanced grapes, and most agree 2009 whites are at least on a par with 2005.	POSITIVE	0.999856173992157
312	312	2008	BURGUNDY - WHITE	Challenging climatic conditions abounded throughout the season, leading to high acidity that gives these whites a particular freshness. Challenging, then, but as ever the best producers have made some spectacular wines.	POSITIVE	0.9998288750648499
313	313	2007	BURGUNDY - WHITE	Another challenging summer with no shortage of rain but for once Chardonnay flowered after Pinot Noir and was more reliably saved by the drying winds that arrived in late August. Crisper whites than in 2005 and 2006.	POSITIVE	0.9914113283157349
314	314	2006	BURGUNDY - WHITE	Poor summer was followed by much-needed fine weather in early September producing a relatively consistent crop of early-maturing, quite fleshy whites.	POSITIVE	0.9991341829299927
315	315	2005	BURGUNDY - WHITE	Very concentrated wines that should last much longer than most white burgundy vintages. Promising indeed.	POSITIVE	0.9992595314979553
316	316	2004	BURGUNDY - WHITE	Acid levels are relatively high and these are not massive wines so are best for classicists who like their white burgundy to be quite angular.	POSITIVE	0.9771263003349304
317	317	2003	BURGUNDY - WHITE	A very difficult year with exceptionally low levels of acid, some of them made from grapes that shrivelled rather than ripened. Curious.	NEGATIVE	0.9980072975158691
318	318	2002	BURGUNDY - WHITE	Good quality and quantity.	POSITIVE	0.9998573064804077
319	319	2001	BURGUNDY - WHITE	Erratic weather produced some rot but also some surprisingly good white wines, if not for the long term, as well as some rather thin, disappointing ones. A variable vintage that rewarded those who limited yields. Devastating hail in parts of the Côte Chalonnaise.	POSITIVE	0.9987715482711792
320	320	2000	BURGUNDY - WHITE	Extremely ripe, sometimes too ripe, healthy grapes with fairly good acidity that were able to charm even in their youth. Especially good for Chablis and the Mâconnais.	POSITIVE	0.9997907280921936
321	321	1999	BURGUNDY - WHITE	Large crop ripened by fine weather in late August and early September. Generally slightly crisper than the 2000s and the best may last longer - if they are allowed to.	POSITIVE	0.9967511892318726
322	322	1998	BURGUNDY - WHITE	Everything went wrong: frost, hail, powdery mildew. Respectable, considering.	POSITIVE	0.834942638874054
323	323	1997	BURGUNDY - WHITE	Charming wines for relatively early drinking.	POSITIVE	0.9998615384101868
324	324	1996	BURGUNDY - WHITE	As with the reds, acidity is the keynote. The best-balanced are stunning but some are a bit meagre.	NEGATIVE	0.6633643507957458
325	325	1995	BURGUNDY - WHITE	Very small crop producing wines with real concentration.	POSITIVE	0.999342143535614
326	326	1994	BURGUNDY - WHITE	Generally better than the reds and certainly more consistent, especially the Mâconnais.	POSITIVE	0.9997660517692566
327	327	1993	BURGUNDY - WHITE	A large, ripe harvest struck by rain, so concentration was a problem.	NEGATIVE	0.9860963225364685
328	328	1992	BURGUNDY - WHITE	Balanced, elegant and refined: best from the Côte d’Or rather than Chablis.	POSITIVE	0.999869167804718
329	329	1991	BURGUNDY - WHITE	Rain reduced acidity and concentration, some were delightful but many were dilute.	NEGATIVE	0.9861080646514893
330	330	1990	BURGUNDY - WHITE	Very ripe but yields were just too high for profound wines. Chablis best.	POSITIVE	0.991679847240448
331	331	1989	BURGUNDY - WHITE	A medium-sized crop produced spectacularly rich and horribly expensive wines.	POSITIVE	0.9990701675415039
332	332	1988	BURGUNDY - WHITE	Pretty lean and astringent.	POSITIVE	0.9997609853744507
333	333	1986	BURGUNDY - WHITE	Not as consistent as 1985, but great from reliable growers.	POSITIVE	0.9996790289878845
334	334	1985	BURGUNDY - WHITE	Beautifully balanced, expansive wines.	POSITIVE	0.999877393245697
335	335	1983	BURGUNDY - WHITE	Huge and alcoholic, the few with acidity to balance were spectacular.	POSITIVE	0.9831522107124329
336	336	2016	LANGUEDOC-ROUSSILLON	Generally warm and sunny throughout the summer with usefully fresh nights, though some regions suffered through lack of rainfall, resulting in smaller yields of concentrated juice. However, these dry conditions did at least result in reduced disease pressure, and quality is generally good across reds and whites, with high flavour intensity.	POSITIVE	0.9997753500938416
