	index	year	region	review	sentiment	score
112	112	2004	BORDEAUX - SWEET	A very difficult year where the strictest selection was needed. Avoid at lower levels. And even the best tend to be pretty light.	NEGATIVE	0.9691159725189209
113	113	2003	BORDEAUX - SWEET	Extreme(ly sweet) but not particularly botrytised wines from this extreme(ly hot, dry) growing season.	NEGATIVE	0.5143954157829285
114	114	2002	BORDEAUX - SWEET	Vineyards near the rivers were blessed with botrytis. Small crop.	POSITIVE	0.9851869940757751
115	115	2001	BORDEAUX - SWEET	The rain that spoilt the reds encouraged botrytis to such an extent that this is a truly magnificent, long-term vintage, helped by a greater degree of selection and cellar expertise than ever before. Perhaps the greatest Sauternes vintage in modern times.	POSITIVE	0.9996060132980347
116	116	2000	BORDEAUX - SWEET	Some pretty, bumptious wines for relatively short-term drinking but there was too much rain after the red wine harvest for the development of botrytis.	NEGATIVE	0.9987110495567322
117	117	1999	BORDEAUX - SWEET	Those producers who used only the very rich, botrytised grapes picked first produced some exciting wines but quality is extremely variable as later-picked grapes suffered somewhat.	NEGATIVE	0.9670658111572266
118	118	1998	BORDEAUX - SWEET	Rather loose, early-drinking wines without strong botrytis influence.	NEGATIVE	0.9992208480834961
119	119	1997	BORDEAUX - SWEET	Some very attractive, if not especially heavy, wines from the top producers. Ready to start drinking.	POSITIVE	0.9996082186698914
120	120	1996	BORDEAUX - SWEET	Very slightly less successful than the 1997 vintage.	NEGATIVE	0.999758780002594
121	121	1995	BORDEAUX - SWEET	Best Sauternes vintage since 1990 - so probably initially overrated. The noble rot developed so rapidly that most of the grapes were picked by early October. Not the most complex vintage.	NEGATIVE	0.9958379864692688
122	122	1994	BORDEAUX - SWEET	Grey rot in September, so choose the châteaux that could afford to be fussy.	NEGATIVE	0.999578058719635
123	123	1993	BORDEAUX - SWEET	Another pretty dreadful autumn, hardly anyone made interesting wine.	NEGATIVE	0.9997822642326355
124	124	1992	BORDEAUX - SWEET	Endless rains ruined the crop. Many estates declassified altogether.	NEGATIVE	0.9997658729553223
125	125	1991	BORDEAUX - SWEET	After the April frosts a tiny crop was eventually harvested, but not bad.	POSITIVE	0.9949946403503418
126	126	1990	BORDEAUX - SWEET	Massive rich wines that presently seem a shade less complex than 1989 and, especially, 1988.	NEGATIVE	0.6149881482124329
127	127	1989	BORDEAUX - SWEET	Huge, almost corpulent wines that are dramatic and exciting.	POSITIVE	0.999851644039154
128	128	1988	BORDEAUX - SWEET	Of the fabulous trio of vintages this shows more botrytis and elegance and may live longest. The least flashy, a slow burner?	NEGATIVE	0.9761555194854736
129	129	1986	BORDEAUX - SWEET	A very strong year, plenty of botrytis and beautifully balanced, though some are a little soft.	POSITIVE	0.9998762607574463
130	130	1985	BORDEAUX - SWEET	Rich and elegant but too little noble rot to add the magic.	NEGATIVE	0.9232833981513977
131	131	1983	BORDEAUX - SWEET	The best since 1976, with similar power and size. Good value too!	POSITIVE	0.9998705387115479
132	132	1982	BORDEAUX - SWEET	Overlooked as a white vintage. Limited botrytis but Suduiraut and Yquem were more successful than most.	POSITIVE	0.9974738359451294
133	133	1980	BORDEAUX - SWEET	Much better than the reds, the top châteaux are delicious and affordable.	POSITIVE	0.9998824596405029
134	134	2016	BURGUNDY - RED	Hail, frost and mildew all made 2016 an extremely difficult year for makers of red burgundy. Yields were universally low, and the fruit had less concentration than in 2015. Beyond that, generalisations are impossible due to the complicated meteorological patterns throughout the year, creating very varied conditions in each sub-region.	NEGATIVE	0.9974882006645203
135	135	2015	BURGUNDY - RED	Low yields and warm weather allowed for ample ripeness, small berries and an early harvest. Quality is looking extremely fine, with some people whispering comparisons with the outstanding 2005 vintage. Acid levels in individual wines may be crucial.	POSITIVE	0.9991889595985413
136	136	2014	BURGUNDY - RED	An unusually mild winter (this was the year of the  Asian fruit fly) preceded an unusually early start to the season. Flowering took place in settled conditions and all seemed set fair for a year of good quantity at last, and an early harvest. Except that the summer was miserably cool and wet (and a dramatic hailstorm on 28 June wreaked havoc on the Côte de Beaune for the third year running) so that growers needed every ray of sunshine in a fine September to recoup their losses. Wines are relatively light.	POSITIVE	0.9980814456939697
137	137	2013	BURGUNDY - RED	A frigid spring delayed flowering and led to uneven ripening. Producers battled with hail (particularly in the Côte de Beaune) and summer downpours, but, despite the naysaying, a drier September allowed a small crop of balanced fruit with good potential.	POSITIVE	0.9986621141433716
138	138	2012	BURGUNDY - RED	Blighted by rot, as a damp summer across Europe made conditions hard for vignerons, with mildew a particular problem. The weather was erratic and bizarre, with heatwaves, hail, a cold spring, thunderstorms and all manner of meteorological mischief. The net results are very low volumes of variable quality – but overall vignerons are surprised and delighted by what resulted. One hallmark of 2012 looks to be soft tannins.	POSITIVE	0.9939028024673462
139	139	2011	BURGUNDY - RED	Disappointing quality with widespread rot and uneven weather conditions throughout the year. The results can be surprisingly good in parts, but 2010 is a much safer bet.	POSITIVE	0.5589025616645813
140	140	2010	BURGUNDY - RED	A return to the high acid norm after 2009, and some very good quality - especially in the Côte de Nuits - but volumes up to a third lower than average.	NEGATIVE	0.9556403160095215
141	141	2009	BURGUNDY - RED	Finally, the Burgundians enjoyed a comparatively dry growing season with consistent warmth and no early season hail damage. Low acidity and ripe tannins should make these reds drinkable early.	POSITIVE	0.9744901657104492
142	142	2008	BURGUNDY - RED	An accursed vintage in Burgundy, with _coulure_, mildew and hail all conspiring to damage yields and quality. Late September sunshine went some way to rescue the crop, however, although high acidity remains the hallmark of this vintage.	NEGATIVE	0.9880571365356445
143	143	2007	BURGUNDY - RED	A dank summer led to rotten Pinot Noir grapes and the need for extremely strict selection. The vintage is unlikely to notch up record scores.	NEGATIVE	0.9995923638343811
144	144	2006	BURGUNDY - RED	Poor summer with vine health problems produced wines which at their best are very pure and expressive and at their worst just a bit too austere for comfort.	NEGATIVE	0.9496132731437683
145	145	2005	BURGUNDY - RED	As in Bordeaux, a quite exceptionally good vintage, although many wines may go through a prolonged stage of chewy adolescence.	POSITIVE	0.9997824430465698
146	146	2004	BURGUNDY - RED	Large vintage of far from flashy but pretty serviceable and certainly good value wines. Relatively light and crisp, for early drinking though the best may surprise in the long run.	POSITIVE	0.9998276233673096
147	147	2003	BURGUNDY - RED	A small proportion of monumental wines from old vines were produced this heatwave year, but generally the frail Pinot Noir grape suffered raisining and made some very unusual wines indeed, some of which provide good, luscious drinking at about five years old but dry tannins are expected to make their presence increasingly felt.	POSITIVE	0.8860820531845093
148	148	2002	BURGUNDY - RED	Good vintage. Summer was not especially hot, though it was reasonably dry. Sugar levels were boosted in September but some grapes were adversely affected by scattered rains then. Sugar levels were quite respectable in the end and most wines showed their charms at an early stage.	POSITIVE	0.9977580308914185
149	149	2001	BURGUNDY - RED	Wet summer with some heat spikes. As for red bordeaux from this vintage, a gentle hand was needed in the winery to retain delicacy and not emphasize the already notable tannins. Quite varied quality. Wines from low-yielding grapes will provide exciting long-term drinking but others are gawky. August hail in Volnay.	NEGATIVE	0.9598491191864014
150	150	2000	BURGUNDY - RED	A difficult vintage for growers, with rain and rot during harvest. Rather soft, easy wines that were more successful in the Côte de Nuits than in much of the Côte de Beaune. Useful early drinking but showing signs of losing fruit by 2008.	NEGATIVE	0.9940476417541504
151	151	1999	BURGUNDY - RED	Exceptional quality and quantity. Powerful, charming and well balanced with great concentration and colour - particularly in the Côte de Beaune. The Côte de Nuits was hampered by a little more rain. Tannins and pigments achieved sumptuous ripeness. A vintage to drink young or old.	POSITIVE	0.9998326301574707
152	152	1998	BURGUNDY - RED	Thick skins made for good colours but pretty tough and stolid wines in general.	POSITIVE	0.9978159070014954
153	153	1997	BURGUNDY - RED	Charming, early-drinking wines – most should have been drunk by now.	POSITIVE	0.9957852363586426
154	154	1996	BURGUNDY - RED	Remarkably high acidity has made its presence increasingly felt over the years in bottle. Some wines just too tart for comfort; others may eventually bloom.	NEGATIVE	0.8699429631233215
155	155	1995	BURGUNDY - RED	Reduced crop of initially rather austere wines which took on fat in bottle and can provide delicious drinking now.	POSITIVE	0.9969061613082886
156	156	1994	BURGUNDY - RED	A year to highlight Burgundy's infamy for variability as too many let yields balloon after the rains.	NEGATIVE	0.9770368933677673
157	157	1993	BURGUNDY - RED	Underrated. Better than average: healthy grapes and well-coloured, fruity wines that have lasted and developed well.	POSITIVE	0.9998682737350464
158	158	1992	BURGUNDY - RED	Rain at the wrong time again. Soft, tender wines to drink young.	POSITIVE	0.9989772439002991
159	159	1991	BURGUNDY - RED	Grapes had ripened before it rained and some wines from the Côtes de Nuits are excellent. Not to be overlooked.	POSITIVE	0.999767005443573
160	160	1990	BURGUNDY - RED	A great success: rich and fragrant. The top vineyards made majestic wines but some lesser wines lacked lusciousness.	POSITIVE	0.99905925989151
161	161	1989	BURGUNDY - RED	Nearly up to 1990, if not as intense. Some real charmers.	POSITIVE	0.9997931718826294
162	162	1988	BURGUNDY - RED	Tough and unusually backward, most are densely concentrated and the best repaid 20 years’ wait.	NEGATIVE	0.9894025921821594
163	163	1987	BURGUNDY - RED	Natural ripeness was a problem so many overchaptalised.	NEGATIVE	0.8379017114639282
164	164	1986	BURGUNDY - RED	A very tricky year of rain and rot. Careful growers avoided the dilution but not a year to seek out.	NEGATIVE	0.7163737416267395
165	165	1985	BURGUNDY - RED	A problem-free year: delicious and fragrant young, but most should have been drunk.	POSITIVE	0.6245517134666443
166	166	1984	BURGUNDY - RED	Poor weather and unripe grapes. One to avoid.	NEGATIVE	0.9996970891952515
167	167	1983	BURGUNDY - RED	A torrid summer and very mixed bag. A handful are brilliant but most are tainted by rot.	NEGATIVE	0.9990479350090027
168	168	1982	BURGUNDY - RED	Large yields of soft, pleasant wines best drunk young.	POSITIVE	0.9997106790542603
169	169	1980	BURGUNDY - RED	Underestimated at first: balanced and scented, though most are past it now.	POSITIVE	0.5994647741317749
170	170	1978	BURGUNDY - RED	A late but uniformly good crop. Top growers made breathtaking wines. Now very rare.	POSITIVE	0.9998506307601929
171	171	2016	CHAMPAGNE	As happened widely across France, frost and hail conspired to lower the yields in the Champagne region in 2016. Quality is generally above average, with Pinot Noir preferred to Chardonnay. The vintage is likely to be declared for several luxury cuvées, including Cristal and Comtes de Champagne.	POSITIVE	0.6790909767150879
172	172	2015	CHAMPAGNE	Very little disease pressure, thanks to dry, sunny conditions over the summer months – the driest on record. Rain arrived in the final week of harvest, but most grapes had already been gathered. The berries tended to be small but with good uniform ripeness, and potential alcohol levels were relatively high at harvest. Richness should characterise the vintage, and Pinot Noir did particularly well. Some excellent vintage champagne should be produced.	POSITIVE	0.9994711875915527
173	173	2014	CHAMPAGNE	Initial reports suggest that a warm, dry September saved the crop from a damper, cooler August. The resulting fruit has good levels of potential alcohol, indicating ample ripeness.	POSITIVE	0.9990683794021606
174	174	2013	CHAMPAGNE	Pales in comparison to the stellar 2012, with a cool spring leading to uneven ripening and one of the latest harvests in 20 years. Summer hail caused widespread damage in the summer months but overall the champenois fared better than many of their compatriots. Likely a vintage year.	POSITIVE	0.827454149723053
175	175	2012	CHAMPAGNE	An exceptional vintage in Champagne. Despite low yields thanks to frost, hail and disease early in the season, August saw conditions improve dramatically resulting in exemplary maturity, acidity and grape health at harvest.	POSITIVE	0.9997572302818298
176	176	2011	CHAMPAGNE	Notable for its erratic growing season, which started warm and dry but then became cooler and wetter in June and July. Conditions improved briefly in August but the (early) harvest was problematic.	NEGATIVE	0.9935837388038635
177	177	2010	CHAMPAGNE	A taxing year with dry conditions retarding grape development early in the season. When rain arrived in August it was torrential, causing widespread disease pressure. The return of dry conditions in September helped some producers over the line, but sorting in the vineyard and winery was crucial.	NEGATIVE	0.5150976777076721
178	178	2009	CHAMPAGNE	After early complications a superb summer produced a clean crop of high quality, with particularly good Pinot Noir from the Montagne de Reims. Wines are plump and approachable.	POSITIVE	0.9998278617858887
179	179	2008	CHAMPAGNE	Initially a difficult, damp year with widespread mildew; drier conditions in August and a fine, warm September proved many producers’ saving grace. Classically styled wines with fresh acidity balanced by sound ripeness achieved late in the season.	POSITIVE	0.999774158000946
180	180	2007	CHAMPAGNE	An unusually warm spring led to early flowering and optimism which soon gave way to disappointment with one of the murkiest summers on record. Conditions improved towards September allowing a fair crop, with Chardonnay outperforming the Pinots. Above average acidities.	POSITIVE	0.9712460041046143
181	181	2006	CHAMPAGNE	An exceptionally hot and sunny June and July with grapes in fine fettle but a dank August left producers fearful of underripeness. Fortunately, warm, bright conditions in September redressed the balance. Wines are supple and expressive.	POSITIVE	0.9979859590530396
182	182	2005	CHAMPAGNE	Variable conditions throughout the year resulted in a lackluster vintage, though favourable weather in the run-up to harvest meant that ripeness was assured. Acidities on the low side.	NEGATIVE	0.6601333022117615
183	183	2004	CHAMPAGNE	Unusually, quality and quantity were both hallmarks of 2004. Structured, well-balanced wines which have exceeded expectation.	POSITIVE	0.9996717572212219
184	184	2003	CHAMPAGNE	Spring frosts followed by one of the hottest summers on record led to small volumes and typically very ripe wines of middling quality. Some fine Pinot Noir dominant blends.	POSITIVE	0.9994399547576904
185	185	2002	CHAMPAGNE	A magnificent vintage for champagne with near-perfect growing conditions, capped by fine dry weather at harvest. Ageworthy wines with plush fruit held in check by keen acidity.	POSITIVE	0.9995546936988831
186	186	2001	CHAMPAGNE	A generally poor vintage characterised by rot and underripeness thanks to a wet and gloomy September.	NEGATIVE	0.9997665882110596
187	187	2000	CHAMPAGNE	Hail, rainstorms, unseasonable cold and mildew made for a testing growing season, but fine conditions in August and September redeemed the vintage. High quality wines for short-term drinking.	POSITIVE	0.9996864795684814
188	188	2016	LOIRE VALLEY	Once again, frost caused significant crop loss in the Loire Valley, especially in Muscadet. Quality and concentration is good, with Chenin Blanc being particularly noteworthy in 2016 while Sancerre is thought to be the best of the Sauvignon Blanc appellations. Cabernet Franc is 'delicious, ripe and fruity' according to Loire courtier Chris Hardy.	POSITIVE	0.9998252391815186
189	189	2015	LOIRE VALLEY	Very promising across the region, with the same warm, dry summer that many other French regions enjoyed. In Muscadet, some rain towards the end of harvest resulted in a little rot, but nothing too concerning. Touraine saw very low yields but excellent quality, as did Sancerre and Pouilly-Fumé. Pinot Noir reached full ripeness, and very promising quality, for all those growers prepared to wait. Chenin Blanc also fared well, with the potential to make good wine at all sweetness levels.	POSITIVE	0.9997153878211975
190	190	2014	LOIRE VALLEY	Lots of top quality wine was produced from the Loire in 2014. Cabernet Franc is garnering particular praise, but there are some excellent whites made from the Muscadet grape Melon de Bourgogne, Sauvignon Blanc and Chenin Blanc (from dry to sweet) too. The only bad news was that, once again, yields were lower than the long-term average.	NEGATIVE	0.9499313235282898
191	191	2013	LOIRE VALLEY	An annus horribilis for the producers of Vouvray and Montlouis whose crops were almost entirely wiped out by a June hailstorm. Elsewhere a sound vintage with good acidity, though the cool spring and mild conditions in August and September meant many reds struggled to achieve full ripeness.	POSITIVE	0.9800536036491394
192	192	2012	LOIRE VALLEY	Despite a challenging growing season, 2012 was the year that Muscadet really shone, producing some of the best examples ever. Yields were around half the average, however. Sancerre and Pouilly-Fumé fared better for whites and reds, with good, uniform ripeness, no rot, and yield in line with the norm. Delayed flowering early in the season proved tricky for Cabernet Franc, because autumnal rains made for diluted fruit as growers waited for ripeness. There were very few botrytised Chenins made in Anjou, Vouvray and Montlouis, but dry wines are promising in a lighter style.	POSITIVE	0.9994043707847595
193	193	2011	LOIRE VALLEY	Pretty rotten. Muscadet and Touraine were both blighted with fungal disease. Cabernet Franc only flourished in the best sites and with suitable selection. Chenin Blanc had a much better year, with Anjou and Coteaux du Layon being particularly impressive.	POSITIVE	0.9409195780754089
194	194	2010	LOIRE VALLEY	Good ripeness and concentration for Muscadet. Delightful Sauvignons too with good concentration and freshness. Late September rain created a bit of rot for the Cabernet Franc, with only the bravest growers waiting for full ripeness to occur – which it did, thanks to two lucky weeks of late sunshine. Chenins fared better in Cotreux du Layon than Vouvray, with the full range of sweetness being made.	POSITIVE	0.9990051984786987
195	195	2009	LOIRE VALLEY	A great vintage. Healthy fruit in Muscadet produced superb quality, especially from those growers prepared to keep yields under control. Touraine Sauvignon Blanc performed similarly well, with full phenolic ripeness and very little chaptalisation requirement, if any. Yields were slightly reduced in Sancerre and Pouilly-Fumé, and some July hail decimated much of Quincy, Reuilly and Coteaux du Giennois - but what was produced is excellent. Cabernet Franc enjoyed a late, dry harvest to make fully ripe reds, and Chenin was also very promising, although there botrytis was scarce.	POSITIVE	0.9997346997261047
196	196	2008	LOIRE VALLEY	A bad start to the growing year – cold and wet in early summer – with a dry but still cool July and August. Frost in Muscadet devastated yields, making for a very hard year for all growers. Sauvignon across the Loire experienced lower yields too, but displays good varietal typicality.	POSITIVE	0.9749401807785034
197	197	2007	LOIRE VALLEY	Early flowering then a cool, wet summer led to a very uneven vintage, although a dry, warm September helped rescue quality. Even so, rot was a problem and required meticulous selection to avoid. Despite that, results were surprisingly good, with dry whites from all varieties performing especially well.	POSITIVE	0.9988263249397278
198	198	2006	LOIRE VALLEY	Very difficult: a July heatwave was followed by cold, wet weather for the rest of the season. Not a write-off, but certainly not a good year.	NEGATIVE	0.9992961287498474
199	199	2005	LOIRE VALLEY	Hot, dry and very good quality. A certain degree of drought meant reduced yields, but cool nights retained freshness, and an early vintage led to fine, healthy grapes at harvest. Especially good in Savennières.	POSITIVE	0.9998335838317871
200	200	2004	LOIRE VALLEY	High yields, with good uniform ripeness and good concentration. Nothing to get unduly excited about, but reliable and classic.	POSITIVE	0.999846875667572
201	201	2003	LOIRE VALLEY	A famously atypical vintage across Europe, which resulted in a great harvest in the Loire. Muscadet is rich and full, but with good natural balance. Cabernet Franc reached full ripeness with ease, giving particularly expressive fruit character. Chenin Blanc was similarly generous, although there was less botrytis than normal. Perhaps the only casualty was Sauvignon Blanc, which was routinely reaching 14% alcohol, resulting in overripe wines without their usual delicacy.	POSITIVE	0.9988659620285034
202	202	2002	LOIRE VALLEY	A successful if somewhat cool year, characterised by classic balance and structure for all varieties. The opposite in style to the opulent	POSITIVE	0.9996591210365295
203	203	2001	LOIRE VALLEY	Good for Muscadet, but bad for Sancerre and Pouilly-Fumé where late rain caused rot. Anjou enjoyed fine, late summer warmth allowing the production of particularly good sweet wines.	POSITIVE	0.9998394250869751
204	204	2000	LOIRE VALLEY	Despite a wet July, quality turned out very well for dry whites and reds. Yields were marginally below average, and there was insufficient ripeness to create any moelleux styles.	NEGATIVE	0.6954814791679382
205	205	2016	SOUTHERN RHÔNE	According to Michel Chapoutier, 2016 could be better than 1990 in the southern Rhône – praise indeed. Warm conditions throughout the year along with reduced yields has resulted in wines of great concentration – in colour, tannin and flavour. Certainly one of the great vintages, for reds anyway.	POSITIVE	0.9993570446968079
206	206	2015	SOUTHERN RHÔNE	Grenache suffered from coulure at flowering, meaning lower yields but the quality is extremely promising. Alcohol levels are likely to be higher than in the two previous vintages.	POSITIVE	0.9994084239006042
207	207	2014	SOUTHERN RHÔNE	A relatively light vintage in terms of alcohol and phenolics, even if not in terms of quantity. A mild winter and wet early spring built up water reserves. The growing season started unusually early but a cool, wet summer put on the brakes so in the end the harvest was one of the latest ever and some red wine grapes struggled to reach full ripeness. Sorting was essential.	NEGATIVE	0.9533625841140747
208	208	2013	SOUTHERN RHÔNE	Coulure was this year’s bugbear for the vignerons of the Southern Rhône, drastically reducing the Grenache crop: 2013 Côtes du Rhône may well be in short supply. As is often the case where low yields are matched by careful selection, overall quality is good.	POSITIVE	0.9993656277656555
209	209	2012	SOUTHERN RHÔNE	Much more successful than 2011. It was a low-acid year in both the northern and southern Rhône. Alcohols are roughly average, but volumes are down by up to 15% on 2011. Clement weather late in the season made for relaxed harvesting however, and vignerons are optimistic about the results which seem to combine ripeness with some freshness.	POSITIVE	0.9979468584060669
210	210	2011	SOUTHERN RHÔNE	Reasonably good quality and good yields, but won't be as brilliant as the preceding two vintages. Often drying tannins.	POSITIVE	0.9859047532081604
211	211	2010	SOUTHERN RHÔNE	A very successful vintage, with precision and freshness allowing great expression of terroir. Equally outstanding for whites and reds. Excellent.	POSITIVE	0.9998838305473328
212	212	2009	SOUTHERN RHÔNE	Hot and dry throughout August, but decent levels of rainfall too, and plenty of wind to keep the vines healthy. Very satisfactory quality fruit at harvest. Impressive. Sometimes over-alcoholic.	POSITIVE	0.9996523261070251
213	213	2008	SOUTHERN RHÔNE	Quite gutless reds, thanks to the rain, although whites are worth a look.	NEGATIVE	0.9475875496864319
214	214	2007	SOUTHERN RHÔNE	Very wet spring but the region had a much drier summer than most of the rest of France. Wines and tannins are very ripe.	POSITIVE	0.9996787309646606
215	215	2006	SOUTHERN RHÔNE	Some very lusciously fruited wines that may not last as long as the 2005s but should provide much drinking pleasure in the medium term.	POSITIVE	0.9986422657966614
216	216	2005	SOUTHERN RHÔNE	Great concentration and potential coinciding with increasing consistency of winemaking quality.	POSITIVE	0.9997217059135437
